GO.ID	Description	p.Val	phenoType
Leukocyte Chemotaxis Involved In Inflammatory Response (GO:0002232)	Leukocyte Chemotaxis Involved In Inflammatory Response 	0.980066183257122	1
Leukocyte Tethering Or Rolling (GO:0050901)	Leukocyte Tethering Or Rolling 	0.614629850988245	1
Leukotriene D4 Biosynthetic Process (GO:1901750)	Leukotriene D4 Biosynthetic Process 	0.819563548423397	1
Leukotriene D4 Metabolic Process (GO:1901748)	Leukotriene D4 Metabolic Process 	0.842244354532878	1
Leukotriene Biosynthetic Process (GO:0019370)	Leukotriene Biosynthetic Process 	0.944937312280748	1
Leukotriene Metabolic Process (GO:0006691)	Leukotriene Metabolic Process 	0.992579136856919	-1
Leukotriene Transport (GO:0071716)	Leukotriene Transport 	0.941343089047581	1
Limb Development (GO:0060173)	Limb Development 	0.973507522253314	-1
Limb Morphogenesis (GO:0035108)	Limb Morphogenesis 	0.910381093642624	1
Linoleic Acid Metabolic Process (GO:0043651)	Linoleic Acid Metabolic Process 	0.952618916290155	1
Lipid Biosynthetic Process (GO:0008610)	Lipid Biosynthetic Process 	0.841404228614964	-1
Lipid Catabolic Process (GO:0016042)	Lipid Catabolic Process 	0.9915697182466	1
Lipid Droplet Disassembly (GO:1905691)	Lipid Droplet Disassembly 	0.814953634219134	-1
Lipid Droplet Formation (GO:0140042)	Lipid Droplet Formation 	0.992224930482182	-1
Lipid Droplet Organization (GO:0034389)	Lipid Droplet Organization 	0.839281744040966	-1
Lipid Hydroxylation (GO:0002933)	Lipid Hydroxylation 	0.489250954678244	-1
Lipid Import Into Cell (GO:0140354)	Lipid Import Into Cell 	0.976000105236186	-1
Lipid Modification (GO:0030258)	Lipid Modification 	0.956148347419809	-1
Lipid Oxidation (GO:0034440)	Lipid Oxidation 	0.883379877536872	1
Lipid Phosphorylation (GO:0046834)	Lipid Phosphorylation 	0.768559120256538	1
Lipid Translocation (GO:0034204)	Lipid Translocation 	0.637695384497163	1
Lipid Transport (GO:0006869)	Lipid Transport 	0.944937312280748	1
Lipopolysaccharide-Mediated Signaling Pathway (GO:0031663)	Lipopolysaccharide-Mediated Signaling Pathway 	0.801762340876825	1
Lipoprotein Biosynthetic Process (GO:0042158)	Lipoprotein Biosynthetic Process 	0.894153196641317	-1
Lipoprotein Catabolic Process (GO:0042159)	Lipoprotein Catabolic Process 	0.822039595168091	-1
Lipoprotein Localization (GO:0044872)	Lipoprotein Localization 	0.979614096421189	-1
Lipoprotein Metabolic Process (GO:0042157)	Lipoprotein Metabolic Process 	0.976000105236186	1
Lipoprotein Transport (GO:0042953)	Lipoprotein Transport 	0.992224930482182	-1
Lipoxygenase Pathway (GO:0019372)	Lipoxygenase Pathway 	0.718301723754782	1
Liver Development (GO:0001889)	Liver Development 	0.908736071021022	1
Locomotor Rhythm (GO:0045475)	Locomotor Rhythm 	0.801762340876825	-1
Long-Chain Fatty Acid Biosynthetic Process (GO:0042759)	Long-Chain Fatty Acid Biosynthetic Process 	0.943897292661325	1
Long-Chain Fatty Acid Catabolic Process (GO:0042758)	Long-Chain Fatty Acid Catabolic Process 	0.665971269391304	-1
Long-Chain Fatty Acid Import Into Cell (GO:0044539)	Long-Chain Fatty Acid Import Into Cell 	0.990171474475642	1
Long-Chain Fatty Acid Metabolic Process (GO:0001676)	Long-Chain Fatty Acid Metabolic Process 	0.83291343361282	-1
Long-Chain Fatty Acid Transport (GO:0015909)	Long-Chain Fatty Acid Transport 	0.690546758058504	-1
Long-Chain fatty-acyl-CoA Biosynthetic Process (GO:0035338)	Long-Chain fatty-acyl-CoA Biosynthetic Process 	0.951106450080847	-1
Long-Chain fatty-acyl-CoA Metabolic Process (GO:0035336)	Long-Chain fatty-acyl-CoA Metabolic Process 	0.951106450080847	-1
Long-Term Memory (GO:0007616)	Long-Term Memory 	0.972347325795156	-1
Long-Term Synaptic Depression (GO:0060292)	Long-Term Synaptic Depression 	0.990171474475642	1
Long-Term Synaptic Potentiation (GO:0060291)	Long-Term Synaptic Potentiation 	0.748642906597441	1
Low-Density Lipoprotein Particle Remodeling (GO:0034374)	Low-Density Lipoprotein Particle Remodeling 	0.991279850534042	1
Lung Development (GO:0030324)	Lung Development 	0.992224930482182	-1
Lung Epithelium Development (GO:0060428)	Lung Epithelium Development 	0.941816966149539	-1
Lymphatic Endothelial Cell Differentiation (GO:0060836)	Lymphatic Endothelial Cell Differentiation 	0.979614096421189	-1
Lymphocyte Activation Involved In Immune Response (GO:0002285)	Lymphocyte Activation Involved In Immune Response 	0.637695384497163	1
Lymphocyte Apoptotic Process (GO:0070227)	Lymphocyte Apoptotic Process 	0.908514832635788	-1
Lymphocyte Chemotaxis (GO:0048247)	Lymphocyte Chemotaxis 	0.801762340876825	-1
Lymphocyte Differentiation (GO:0030098)	Lymphocyte Differentiation 	0.966675843388635	1
Lymphocyte Mediated Immunity (GO:0002449)	Lymphocyte Mediated Immunity 	0.78594334911498	1
Lymphocyte Migration (GO:0072676)	Lymphocyte Migration 	0.794537571928785	-1
Lymphocyte Migration Into Lymphoid Organs (GO:0097021)	Lymphocyte Migration Into Lymphoid Organs 	0.801762340876825	-1
Lymphocyte Proliferation (GO:0046651)	Lymphocyte Proliferation 	0.917009770855648	1
Lymphoid Progenitor Cell Differentiation (GO:0002320)	Lymphoid Progenitor Cell Differentiation 	0.978664671014649	1
Lysosomal Lumen Acidification (GO:0007042)	Lysosomal Lumen Acidification 	0.976000105236186	-1
Lysosomal Membrane Organization (GO:0097212)	Lysosomal Membrane Organization 	0.489250954678244	-1
Lysosomal Microautophagy (GO:0016237)	Lysosomal Microautophagy 	0.908514832635788	-1
Lysosomal Transport (GO:0007041)	Lysosomal Transport 	0.992224930482182	1
Lysosome Localization (GO:0032418)	Lysosome Localization 	0.801762340876825	-1
Lysosome Organization (GO:0007040)	Lysosome Organization 	0.775818257797784	-1
Lytic Vacuole Organization (GO:0080171)	Lytic Vacuole Organization 	0.815127076468889	-1
mRNA 3'-End Processing (GO:0031124)	mRNA 3'-End Processing 	0.957130388694924	-1
mRNA 3'-End Processing By Stem-Loop Binding And Cleavage (GO:0006398)	mRNA 3'-End Processing By Stem-Loop Binding And Cleavage 	0.984793132234776	1
mRNA 3'-Splice Site Recognition (GO:0000389)	mRNA 3'-Splice Site Recognition 	0.992224930482182	-1
mRNA 5'-Splice Site Recognition (GO:0000395)	mRNA 5'-Splice Site Recognition 	0.801762340876825	-1
mRNA Catabolic Process (GO:0006402)	mRNA Catabolic Process 	0.978986692422588	-1
mRNA Cis Splicing, Via Spliceosome (GO:0045292)	mRNA Cis Splicing, Via Spliceosome 	0.667717878307926	-1
mRNA Cleavage Involved In mRNA Processing (GO:0098787)	mRNA Cleavage Involved In mRNA Processing 	0.443277664918059	-1
mRNA Destabilization (GO:0061157)	mRNA Destabilization 	0.827757976739516	-1
mRNA Export From Nucleus (GO:0006406)	mRNA Export From Nucleus 	0.908514832635788	-1
mRNA Metabolic Process (GO:0016071)	mRNA Metabolic Process 	0.718301723754782	-1
mRNA Methylation (GO:0080009)	mRNA Methylation 	0.718301723754782	1
mRNA Modification (GO:0016556)	mRNA Modification 	0.614629850988245	1
mRNA Polyadenylation (GO:0006378)	mRNA Polyadenylation 	0.876254482450606	1
mRNA Processing (GO:0006397)	mRNA Processing 	0.000239748385647964	-1
mRNA Pseudouridine Synthesis (GO:1990481)	mRNA Pseudouridine Synthesis 	0.815227427330273	1
mRNA Splice Site Recognition (GO:0006376)	mRNA Splice Site Recognition 	0.560281942039648	-1
mRNA Splicing, Via Spliceosome (GO:0000398)	mRNA Splicing, Via Spliceosome 	0.000587010031575238	-1
mRNA Stabilization (GO:0048255)	mRNA Stabilization 	0.976000105236186	-1
mRNA Transcription (GO:0009299)	mRNA Transcription 	0.944937312280748	-1
mRNA Transcription By RNA Polymerase II (GO:0042789)	mRNA Transcription By RNA Polymerase II 	0.944937312280748	-1
mRNA Transport (GO:0051028)	mRNA Transport 	0.976994614398286	-1
Macroautophagy (GO:0016236)	Macroautophagy 	0.214674416945213	-1
Macromolecule Biosynthetic Process (GO:0009059)	Macromolecule Biosynthetic Process 	0.962314338222431	-1
Macromolecule Catabolic Process (GO:0009057)	Macromolecule Catabolic Process 	0.951106450080847	-1
Macromolecule Depalmitoylation (GO:0098734)	Macromolecule Depalmitoylation 	0.837760481278367	-1
Macromolecule Modification (GO:0043412)	Macromolecule Modification 	0.978664671014649	1
Macrophage Activation (GO:0042116)	Macrophage Activation 	0.986568635130481	1
Macrophage Activation Involved In Immune Response (GO:0002281)	Macrophage Activation Involved In Immune Response 	0.987491706383773	-1
Macrophage Chemotaxis (GO:0048246)	Macrophage Chemotaxis 	0.979614096421189	-1
Macrophage Derived Foam Cell Differentiation (GO:0010742)	Macrophage Derived Foam Cell Differentiation 	0.897204902389042	1
Macrophage Differentiation (GO:0030225)	Macrophage Differentiation 	0.992224930482182	1
Macrophage Migration (GO:1905517)	Macrophage Migration 	0.992224930482182	-1
Macropinocytosis (GO:0044351)	Macropinocytosis 	0.690546758058504	-1
Magnesium Ion Transport (GO:0015693)	Magnesium Ion Transport 	0.984793132234776	1
Maintenance Of DNA Repeat Elements (GO:0043570)	Maintenance Of DNA Repeat Elements 	0.876254482450606	-1
Maintenance Of Apical/Basal Cell Polarity (GO:0035090)	Maintenance Of Apical/Basal Cell Polarity 	0.71655666572798	-1
Maintenance Of Blood-Brain Barrier (GO:0035633)	Maintenance Of Blood-Brain Barrier 	0.771788703921558	1
Maintenance Of Epithelial Cell Apical/Basal Polarity (GO:0045199)	Maintenance Of Epithelial Cell Apical/Basal Polarity 	0.71655666572798	-1
Maintenance Of Gastrointestinal Epithelium (GO:0030277)	Maintenance Of Gastrointestinal Epithelium 	0.897204902389042	1
Maintenance Of Lens Transparency (GO:0036438)	Maintenance Of Lens Transparency 	0.976000105236186	1
Maintenance Of Protein Localization In Endoplasmic Reticulum (GO:0035437)	Maintenance Of Protein Localization In Endoplasmic Reticulum 	0.797074207709824	-1
Maintenance Of Protein Localization In Organelle (GO:0072595)	Maintenance Of Protein Localization In Organelle 	0.992224930482182	1
Maintenance Of Protein Location In Extracellular Region (GO:0071694)	Maintenance Of Protein Location In Extracellular Region 	0.84191364980781	1
Maintenance Of Protein Location In Nucleus (GO:0051457)	Maintenance Of Protein Location In Nucleus 	0.945323954706251	1
Maintenance Of Synapse Structure (GO:0099558)	Maintenance Of Synapse Structure 	0.9915697182466	1
Malate Metabolic Process (GO:0006108)	Malate Metabolic Process 	0.862043466651724	-1
Male Gonad Development (GO:0008584)	Male Gonad Development 	0.718301723754782	1
Male Meiosis I (GO:0007141)	Male Meiosis I 	0.917009770855648	1
Mammary Gland Development (GO:0030879)	Mammary Gland Development 	0.914589058998243	-1
Mammary Gland Epithelial Cell Differentiation (GO:0060644)	Mammary Gland Epithelial Cell Differentiation 	0.864525943601454	-1
Mammary Gland Epithelium Development (GO:0061180)	Mammary Gland Epithelium Development 	0.94273060712324	-1
Manganese Ion Transport (GO:0006828)	Manganese Ion Transport 	0.951106450080847	1
Marginal Zone B Cell Differentiation (GO:0002315)	Marginal Zone B Cell Differentiation 	0.968330425253346	-1
Mast Cell Activation Involved In Immune Response (GO:0002279)	Mast Cell Activation Involved In Immune Response 	0.821745960603808	-1
Mast Cell Degranulation (GO:0043303)	Mast Cell Degranulation 	0.821745960603808	-1
Mast Cell Mediated Immunity (GO:0002448)	Mast Cell Mediated Immunity 	0.818448031610543	-1
Maturation Of 5.8S rRNA (GO:0000460)	Maturation Of 5.8S rRNA 	0.843642888884263	1
Maturation Of 5.8S rRNA From Tricistronic rRNA Transcript (SSU-rRNA, 5.8S rRNA, LSU-rRNA) (GO:0000466)	Maturation Of 5.8S rRNA From Tricistronic rRNA Transcript 	0.835908623913643	1
Maturation Of LSU-rRNA (GO:0000470)	Maturation Of LSU-rRNA 	0.489250954678244	1
Maturation Of LSU-rRNA From Tricistronic rRNA Transcript (SSU-rRNA, 5.8S rRNA, LSU-rRNA) (GO:0000463)	Maturation Of LSU-rRNA From Tricistronic rRNA Transcript 	0.419717275870492	1
Maturation Of SSU-rRNA (GO:0030490)	Maturation Of SSU-rRNA 	0.8238047917838	1
Maturation Of SSU-rRNA From Tricistronic rRNA Transcript (SSU-rRNA, 5.8S rRNA, LSU-rRNA) (GO:0000462)	Maturation Of SSU-rRNA From Tricistronic rRNA Transcript 	0.711433981125006	1
Mature B Cell Differentiation Involved In Immune Response (GO:0002313)	Mature B Cell Differentiation Involved In Immune Response 	0.949029105436374	-1
Medium-Chain Fatty Acid Biosynthetic Process (GO:0051792)	Medium-Chain Fatty Acid Biosynthetic Process 	0.591134078120493	-1
Medium-Chain Fatty Acid Metabolic Process (GO:0051791)	Medium-Chain Fatty Acid Metabolic Process 	0.54682479644179	-1
Medium-Chain fatty-acyl-CoA Metabolic Process (GO:0036112)	Medium-Chain fatty-acyl-CoA Metabolic Process 	0.951106450080847	1
Megakaryocyte Development (GO:0035855)	Megakaryocyte Development 	0.885231130850334	1
Megakaryocyte Differentiation (GO:0030219)	Megakaryocyte Differentiation 	0.991279850534042	1
Meiosis I (GO:0007127)	Meiosis I 	0.799811856466869	1
Meiotic DNA Double-Strand Break Formation (GO:0042138)	Meiotic DNA Double-Strand Break Formation 	0.973854494424032	1
Meiotic Sister Chromatid Cohesion (GO:0051177)	Meiotic Sister Chromatid Cohesion 	0.560281942039648	1
Melanin Biosynthetic Process (GO:0042438)	Melanin Biosynthetic Process 	0.986248746549686	-1
Melanocyte Differentiation (GO:0030318)	Melanocyte Differentiation 	0.968367858335472	1
Melanosome Assembly (GO:1903232)	Melanosome Assembly 	0.928463366722498	-1
Melanosome Localization (GO:0032400)	Melanosome Localization 	0.992224930482182	-1
Melanosome Organization (GO:0032438)	Melanosome Organization 	0.863924020685155	1
Melanosome Transport (GO:0032402)	Melanosome Transport 	0.944937312280748	-1
Membrane Assembly (GO:0071709)	Membrane Assembly 	0.541100471084538	-1
Membrane Biogenesis (GO:0044091)	Membrane Biogenesis 	0.876254482450606	1
Membrane Depolarization (GO:0051899)	Membrane Depolarization 	0.301269337544489	1
Membrane Depolarization During Action Potential (GO:0086010)	Membrane Depolarization During Action Potential 	0.970809620092898	-1
Membrane Depolarization During Cardiac Muscle Cell Action Potential (GO:0086012)	Membrane Depolarization During Cardiac Muscle Cell Action Potential 	0.927857894545631	-1
Membrane Fission (GO:0090148)	Membrane Fission 	0.690546758058504	-1
Membrane Fusion (GO:0061025)	Membrane Fusion 	0.992224930482182	1
Membrane Invagination (GO:0010324)	Membrane Invagination 	0.970258373531726	-1
Membrane Lipid Biosynthetic Process (GO:0046467)	Membrane Lipid Biosynthetic Process 	0.932191239099297	-1
Membrane Lipid Catabolic Process (GO:0046466)	Membrane Lipid Catabolic Process 	0.79426722250674	1
Membrane Lipid Metabolic Process (GO:0006643)	Membrane Lipid Metabolic Process 	0.822228088183133	1
Membrane Organization (GO:0061024)	Membrane Organization 	0.718301723754782	-1
Membrane Protein Ectodomain Proteolysis (GO:0006509)	Membrane Protein Ectodomain Proteolysis 	0.992224930482182	1
Membrane Protein Intracellular Domain Proteolysis (GO:0031293)	Membrane Protein Intracellular Domain Proteolysis 	0.876254482450606	1
Membrane Protein Proteolysis (GO:0033619)	Membrane Protein Proteolysis 	0.976994614398286	-1
Membrane Raft Organization (GO:0031579)	Membrane Raft Organization 	0.869938245396805	-1
Membrane Repolarization (GO:0086009)	Membrane Repolarization 	0.839281744040966	1
Membrane Repolarization During Action Potential (GO:0086011)	Membrane Repolarization During Action Potential 	0.976994614398286	1
Membrane Repolarization During Cardiac Muscle Cell Action Potential (GO:0086013)	Membrane Repolarization During Cardiac Muscle Cell Action Potential 	0.837760481278367	-1
Memory (GO:0007613)	Memory 	0.981161585925626	1
Mesenchymal Cell Differentiation (GO:0048762)	Mesenchymal Cell Differentiation 	0.965301657249797	-1
Mesenchymal Cell Differentiation Involved In Kidney Development (GO:0072161)	Mesenchymal Cell Differentiation Involved In Kidney Development 	0.904346885405672	-1
Mesenchymal Cell Migration (GO:0090497)	Mesenchymal Cell Migration 	0.979614096421189	-1
Mesenchymal To Epithelial Transition (GO:0060231)	Mesenchymal To Epithelial Transition 	0.999173001955479	-1
Mesenchymal To Epithelial Transition Involved In Metanephros Morphogenesis (GO:0003337)	Mesenchymal To Epithelial Transition Involved In Metanephros Morphogenesis 	0.991279850534042	-1
Mesenchyme Development (GO:0060485)	Mesenchyme Development 	0.966675843388635	-1
Mesenchyme Morphogenesis (GO:0072132)	Mesenchyme Morphogenesis 	0.951106450080847	-1
Mesoderm Development (GO:0007498)	Mesoderm Development 	0.932502573188877	1
Mesoderm Formation (GO:0001707)	Mesoderm Formation 	0.976000105236186	-1
Mesoderm Morphogenesis (GO:0048332)	Mesoderm Morphogenesis 	0.806392332465327	-1
Mesodermal Cell Differentiation (GO:0048333)	Mesodermal Cell Differentiation 	0.801762340876825	1
Mesodermal Cell Fate Commitment (GO:0001710)	Mesodermal Cell Fate Commitment 	0.976994614398286	-1
Mesonephric Tubule Development (GO:0072164)	Mesonephric Tubule Development 	0.978664671014649	1
Mesonephros Development (GO:0001823)	Mesonephros Development 	0.976000105236186	1
Metal Ion Transport (GO:0030001)	Metal Ion Transport 	0.712702896088856	1
Metallo-Sulfur Cluster Assembly (GO:0031163)	Metallo-Sulfur Cluster Assembly 	0.541100471084538	-1
Metanephric Collecting Duct Development (GO:0072205)	Metanephric Collecting Duct Development 	0.976891366277035	-1
Metanephric Mesenchyme Development (GO:0072075)	Metanephric Mesenchyme Development 	0.966675843388635	-1
Metanephric Nephron Tubule Development (GO:0072234)	Metanephric Nephron Tubule Development 	0.944937312280748	-1
Metanephros Development (GO:0001656)	Metanephros Development 	0.904346885405672	1
Metaphase Plate Congression (GO:0051310)	Metaphase Plate Congression 	0.999957744290172	1
Methionine Metabolic Process (GO:0006555)	Methionine Metabolic Process 	0.985660295438507	1
Methylguanosine-Cap Decapping (GO:0110156)	Methylguanosine-Cap Decapping 	0.990171474475642	1
miRNA Catabolic Process (GO:0010587)	miRNA Catabolic Process 	0.801762340876825	1
miRNA Metabolic Process (GO:0010586)	miRNA Metabolic Process 	0.992224930482182	1
miRNA Processing (GO:0035196)	miRNA Processing 	0.75566199670555	-1
miRNA-mediated Gene Silencing (GO:0035195)	miRNA-mediated Gene Silencing 	0.981161585925626	-1
miRNA-mediated Gene Silencing By Inhibition Of Translation (GO:0035278)	miRNA-mediated Gene Silencing By Inhibition Of Translation 	0.837760481278367	-1
Microglial Cell Activation (GO:0001774)	Microglial Cell Activation 	0.988826197818759	1
Microtubule Anchoring (GO:0034453)	Microtubule Anchoring 	0.882523198887705	1
Microtubule Anchoring At Centrosome (GO:0034454)	Microtubule Anchoring At Centrosome 	0.801762340876825	1
Microtubule Anchoring At Microtubule Organizing Center (GO:0072393)	Microtubule Anchoring At Microtubule Organizing Center 	0.887907345456726	1
Microtubule Bundle Formation (GO:0001578)	Microtubule Bundle Formation 	0.54682479644179	1
Microtubule Cytoskeleton Organization Involved In Mitosis (GO:1902850)	Microtubule Cytoskeleton Organization Involved In Mitosis 	0.748642906597441	1
Microtubule Depolymerization (GO:0007019)	Microtubule Depolymerization 	0.951106450080847	1
Microtubule Nucleation (GO:0007020)	Microtubule Nucleation 	0.799811856466869	1
Microtubule Polymerization (GO:0046785)	Microtubule Polymerization 	0.973854494424032	1
Microtubule Polymerization Or Depolymerization (GO:0031109)	Microtubule Polymerization Or Depolymerization 	0.978986692422588	1
Microtubule-Based Transport (GO:0099111)	Microtubule-Based Transport 	0.978986692422588	1
Microvillus Assembly (GO:0030033)	Microvillus Assembly 	0.976994614398286	-1
Microvillus Organization (GO:0032528)	Microvillus Organization 	0.951106450080847	-1
Midbody Abscission (GO:0061952)	Midbody Abscission 	0.489250954678244	-1
Midbrain Dopaminergic Neuron Differentiation (GO:1904948)	Midbrain Dopaminergic Neuron Differentiation 	0.667717878307926	-1
Mismatch Repair (GO:0006298)	Mismatch Repair 	0.951106450080847	1
Mitochondrial ATP Synthesis Coupled Electron Transport (GO:0042775)	Mitochondrial ATP Synthesis Coupled Electron Transport 	0.711433981125006	1
Mitochondrial DNA Metabolic Process (GO:0032042)	Mitochondrial DNA Metabolic Process 	0.502560459044515	1
Mitochondrial DNA Replication (GO:0006264)	Mitochondrial DNA Replication 	0.637695384497163	1
Mitochondrial RNA 3'-End Processing (GO:0000965)	Mitochondrial RNA 3'-End Processing 	0.712847694612677	1
Mitochondrial RNA Metabolic Process (GO:0000959)	Mitochondrial RNA Metabolic Process 	0.191115437045366	1
Mitochondrial RNA Processing (GO:0000963)	Mitochondrial RNA Processing 	0.196973051857487	1
Mitochondrial Calcium Ion Homeostasis (GO:0051560)	Mitochondrial Calcium Ion Homeostasis 	0.887907345456726	-1
Mitochondrial Calcium Ion Transmembrane Transport (GO:0006851)	Mitochondrial Calcium Ion Transmembrane Transport 	0.775818257797784	-1
Mitochondrial Cytochrome C Oxidase Assembly (GO:0033617)	Mitochondrial Cytochrome C Oxidase Assembly 	0.941343089047581	-1
Mitochondrial Electron Transport, NADH To Ubiquinone (GO:0006120)	Mitochondrial Electron Transport, NADH To Ubiquinone 	0.560281942039648	1
Mitochondrial Electron Transport, Cytochrome C To Oxygen (GO:0006123)	Mitochondrial Electron Transport, Cytochrome C To Oxygen 	0.951106450080847	1
Mitochondrial Electron Transport, Ubiquinol To Cytochrome C (GO:0006122)	Mitochondrial Electron Transport, Ubiquinol To Cytochrome C 	0.951106450080847	1
Mitochondrial Fission (GO:0000266)	Mitochondrial Fission 	0.992224930482182	-1
Mitochondrial Fragmentation Involved In Apoptotic Process (GO:0043653)	Mitochondrial Fragmentation Involved In Apoptotic Process 	0.973854494424032	-1
Mitochondrial Fusion (GO:0008053)	Mitochondrial Fusion 	0.979614096421189	-1
Mitochondrial Gene Expression (GO:0140053)	Mitochondrial Gene Expression 	0.718301723754782	1
Mitochondrial Genome Maintenance (GO:0000002)	Mitochondrial Genome Maintenance 	0.834951862891397	1
Mitochondrial Membrane Organization (GO:0007006)	Mitochondrial Membrane Organization 	0.718301723754782	-1
Mitochondrial Outer Membrane Permeabilization (GO:0097345)	Mitochondrial Outer Membrane Permeabilization 	0.94273060712324	-1
Mitochondrial Protein Catabolic Process (GO:0035694)	Mitochondrial Protein Catabolic Process 	0.991279850534042	-1
Mitochondrial Protein Processing (GO:0034982)	Mitochondrial Protein Processing 	0.801762340876825	-1
Mitochondrial Proton-Transporting ATP Synthase Complex Assembly (GO:0033615)	Mitochondrial Proton-Transporting ATP Synthase Complex Assembly 	0.944937312280748	-1
Mitochondrial Respirasome Assembly (GO:0097250)	Mitochondrial Respirasome Assembly 	0.788732145650509	1
Mitochondrial Respiratory Chain Complex I Assembly (GO:0032981)	Mitochondrial Respiratory Chain Complex I Assembly 	0.382863798348177	1
Mitochondrial Respiratory Chain Complex III Assembly (GO:0034551)	Mitochondrial Respiratory Chain Complex III Assembly 	0.843642888884263	-1
Mitochondrial Respiratory Chain Complex Assembly (GO:0033108)	Mitochondrial Respiratory Chain Complex Assembly 	0.79426722250674	1
Mitochondrial Ribosome Assembly (GO:0061668)	Mitochondrial Ribosome Assembly 	0.496551870463082	1
Mitochondrial tRNA Modification (GO:0070900)	Mitochondrial tRNA Modification 	0.864525943601454	1
Mitochondrial tRNA Processing (GO:0090646)	Mitochondrial tRNA Processing 	0.839281744040966	1
Mitochondrial Transcription (GO:0006390)	Mitochondrial Transcription 	0.443277664918059	1
Mitochondrial Translation (GO:0032543)	Mitochondrial Translation 	0.8238047917838	1
Mitochondrial Translational Elongation (GO:0070125)	Mitochondrial Translational Elongation 	0.718301723754782	1
Mitochondrial Transport (GO:0006839)	Mitochondrial Transport 	0.911981255219687	-1
Mitochondrion Disassembly (GO:0061726)	Mitochondrion Disassembly 	0.196973051857487	-1
Mitochondrion Distribution (GO:0048311)	Mitochondrion Distribution 	0.979614096421189	-1
Mitochondrion Morphogenesis (GO:0070584)	Mitochondrion Morphogenesis 	0.973507522253314	1
Mitochondrion Organization (GO:0007005)	Mitochondrion Organization 	0.737798322493413	1
Mitochondrion Transport Along Microtubule (GO:0047497)	Mitochondrion Transport Along Microtubule 	0.976000105236186	1
Mitochondrion-Endoplasmic Reticulum Membrane Tethering (GO:1990456)	Mitochondrion-Endoplasmic Reticulum Membrane Tethering 	0.992224930482182	1
Mitophagy (GO:0000423)	Mitophagy 	0.843642888884263	-1
Mitotic DNA Damage Checkpoint Signaling (GO:0044773)	Mitotic DNA Damage Checkpoint Signaling 	0.874417338485137	1
Mitotic DNA Integrity Checkpoint Signaling (GO:0044774)	Mitotic DNA Integrity Checkpoint Signaling 	0.862043466651724	-1
Mitotic DNA Replication (GO:1902969)	Mitotic DNA Replication 	0.79426722250674	-1
Mitotic DNA Replication Checkpoint Signaling (GO:0033314)	Mitotic DNA Replication Checkpoint Signaling 	0.992224930482182	1
Mitotic G1 DNA Damage Checkpoint Signaling (GO:0031571)	Mitotic G1 DNA Damage Checkpoint Signaling 	0.944937312280748	1
Mitotic G1/S Transition Checkpoint Signaling (GO:0044819)	Mitotic G1/S Transition Checkpoint Signaling 	0.877760035178066	1
Mitotic G2 DNA Damage Checkpoint Signaling (GO:0007095)	Mitotic G2 DNA Damage Checkpoint Signaling 	0.951106450080847	1
Mitotic G2/M Transition Checkpoint (GO:0044818)	Mitotic G2/M Transition Checkpoint 	0.978986692422588	-1
Mitotic Cell Cycle Checkpoint Signaling (GO:0007093)	Mitotic Cell Cycle Checkpoint Signaling 	0.869938245396805	-1
Mitotic Cell Cycle Phase Transition (GO:0044772)	Mitotic Cell Cycle Phase Transition 	0.951106450080847	1
Mitotic Chromosome Condensation (GO:0007076)	Mitotic Chromosome Condensation 	0.883379877536872	1
Mitotic Cytokinesis (GO:0000281)	Mitotic Cytokinesis 	0.883379877536872	-1
Mitotic Cytokinetic Process (GO:1902410)	Mitotic Cytokinetic Process 	0.637695384497163	-1
Mitotic intra-S DNA Damage Checkpoint Signaling (GO:0031573)	Mitotic intra-S DNA Damage Checkpoint Signaling 	0.992224930482182	1
Mitotic Metaphase Plate Congression (GO:0007080)	Mitotic Metaphase Plate Congression 	0.977237823982496	1
Mitotic Nuclear Division (GO:0140014)	Mitotic Nuclear Division 	0.665971269391304	1
Mitotic Nuclear Membrane Disassembly (GO:0007077)	Mitotic Nuclear Membrane Disassembly 	0.944937312280748	-1
