42,cercocebus_atys,Sooty Mangabey,Cercocebus atys,cerAty1,vs_cerAty1,709,Cercopithecidae,cerAty1,cerAty1,Cercocebus_atys_CERCOPITHECIDAE_PRIMATES,Cercocebus_atys,cerAty1,-,Omnivore,Omnivore,_Omnivore,10,0,0,0,0,0,40,0,50,0,Ref_73,ABC,Ar,A,,0,0,1,Ref_1,ABC,6941.24,Ref_58,1,0,1,1,0,0,0,0,0,0,0,0,0,0,0,Omnivore,0,1,NA,NA,0,0,0,1,NA,NA,NA,NA,NA,NA,NA,NA,NA,NA,NA,NA,NA,NA,NA,NA,NA,NA,NA,NA,0,Species,atys is a sub-group of torquatus; Torquatus diet consisted of fruits and animal matter,,,,,NA,captive,2,0,0,0,1,0,0,0,1,TRUE
43,cercopithecus_neglectus,Guenon,Cercopithecus neglectus,NA,vs_HLcerNeg1,715,Cercopithecidae,,HLcerNeg1,Cercopithecus_neglectus_CERCOPITHECIDAE_PRIMATES,Cercopithecus_neglectus,HLcerNeg1,-,NA,Omnivore,_Omnivore,20,0,0,0,10,0,50,0,10,10,Ref_1,ABC,Ar,A,,0,0,1,Ref_1,ABC,5479.99,Ref_117,1,0,1,1,1,0,1,1,0,1,0,0,0,0,0,Omnivore,0,1,NA,NA,0,0,0,1,NA,NA,NA,NA,NA,NA,NA,NA,NA,NA,NA,NA,NA,NA,NA,NA,NA,NA,NA,NA,0,Genus,"The diet is varied but consists mainly of fruits and seeds therof. A substantial amount of leaves also is eated, some grain and roots, and, at least on occasion, young birds, birds' eggs small reptiles, and insects. ",,,,,NA,captive,2,0,0,0,1,0,0,0,0,FALSE
44,cheirogaleus_medius,Dwarf Lemur,Cheirogaleus medius,NA,vs_HLcheMed1,472,Cheirogaleidae,,HLcheMed1,Cheirogaleus_medius_CHEIROGALEIDAE_PRIMATES,Cheirogaleus_medius,HLcheMed1,-,NA,Herbivore,Herbivore,20,0,0,0,0,0,30,20,0,30,Ref_1,ABC,Ar,A,,1,0,0,Ref_1,ABC,181,Ref_117,1,0,0,1,1,0,0,0,1,0,0,0,0,0,0,Herbivore,0,0,0,NA,0,0,0,1,NA,NA,NA,NA,NA,NA,NA,NA,NA,NA,NA,NA,NA,NA,NA,NA,NA,NA,0.00269,2.49,0,Genus,"The diet consists mainly of fruit, flowers, nectar, and insects. ",,,,,NA,captive,2,0,0,0,1,1,0,0,0,FALSE
45,chinchilla_lanigera,Chinchilla,Chinchilla lanigera,chiLan1,vs_chiLan1,3034,Chinchillidae,chiLan1,chiLan1,Chinchilla_lanigera_CHINCHILLIDAE_RODENTIA,Chinchilla_lanigera,chiLan1,-,Herbivore,Herbivore,Herbivore,0,0,0,0,0,0,0,0,0,100,Ref_1,ABC,G,A,,1,1,0,Ref_1,ABC,417,Ref_117,1,0,0,0,0,0,1,1,0,0,0,0,0,0,0,Herbivore,0,0,0,0,0,0,0,1,NA,NA,NA,NA,NA,NA,NA,NA,NA,NA,NA,NA,NA,NA,NA,NA,NA,NA,NA,NA,0,Genus,Any available vegetation,,,,,NA,wild,0,0,0,0,1,1,0,0,1,TRUE
46,chlorocebus_sabaeus,Green monkey,Chlorocebus sabaeus,chlSab2,vs_chlSab2,739,Cercopithecidae,chlSab1,chlSab2,Chlorocebus_sabaeus_CERCOPITHECIDAE_PRIMATES,Chlorocebus_sabaeus,chlSab2,-,Omnivore,Omnivore,_Omnivore,20,0,0,0,20,0,40,0,0,20,Ref_1,ABC,S,A,,0,0,1,Ref_1,ABC,4993,"Ref_2, Ref_3",0,0,1,1,1,0,1,1,0,1,0,0,0,0,0,Omnivore,0,1,NA,NA,0,0,0,1,NA,NA,NA,NA,NA,NA,NA,NA,NA,NA,NA,NA,NA,NA,NA,NA,NA,NA,NA,NA,0,,"More than half of feeding time involved hunting for fiddler crabs, eat a variety of fruits, other plant parts, insects, crustraceans, birds eggs, and small vertebrates",,,,,NA,captive,2,0,0,0,1,0,0,0,1,TRUE
47,chrysochloris_asiatica,Cape golden mole,Chrysochloris asiatica,chrAsi1,vs_chrAsi1,370,Chrysochloridae,chrAsi1,chrAsi1,Chrysochloris_asiatica_CHRYSOCHLORIDAE_AFROSORICIDA,Chrysochloris_asiatica,chrAsi1,-,Insectivore,Insectivore,Insectivore,100,0,0,0,0,0,0,0,0,0,Ref_1,ABC,G,A,,1,0,0,Ref_1,ABC,49,Ref_117,1,0,0,0,0,1,0,0,0,0,0,0,0,0,0,Insectivore,0,N/A,NA,1,0,0,0,1,NA,NA,NA,NA,NA,NA,NA,NA,NA,NA,NA,NA,NA,NA,NA,NA,NA,NA,NA,NA,0,,"Invertebrates, beetles, grubs, and worms",,,,,NA,wild,0,0,0,0,1,0,0,1,1,TRUE
48,colobus_angolensis,Black-and-white Colobus Monkey,Colobus angolensis,colAng1,vs_colAng1,758,Cercopithecidae,colAng1,colAng1,Colobus_angolensis_CERCOPITHECIDAE_PRIMATES,Colobus_angolensis,colAng1,-,Herbivore,Herbivore,Herbivore,0,0,0,0,0,0,30,0,0,70,Ref_1,ABC,Ar,A,,0,0,1,Ref_1,ABC,9850,Ref_117,1,0,0,1,0,0,1,1,0,0,0,0,0,0,0,Herbivore,0,0,0,0,0,0,0,1,NA,NA,NA,NA,NA,NA,NA,NA,NA,NA,NA,NA,NA,NA,NA,NA,NA,NA,NA,NA,0,Genus,"The diet consists mostly of leaves, but fruits and flowers are at least seasonally important.",,,,,NA,captive,2,0,0,0,1,1,0,0,1,TRUE
49,condylura_cristata,Star-nosed mole,Condylura cristata,conCri1,vs_conCri1,3628,Talpidae,conCri1,conCri1,Condylura_cristata_TALPIDAE_EULIPOTYPHLA,Condylura_cristata,conCri1,-,Insectivore/Piscivore,Insectivore/Piscivore,Insectivore,80,0,0,20,0,0,0,0,0,0,Ref_1,ABC,G,A,,1,1,1,Ref_1,ABC,84,Ref_117,1,1,0,0,1,1,0,0,0,0,0,0,0,1,0,Insectivore/Piscivore,0,1,NA,NA,0.5,NA,NA,NA,NA,NA,NA,NA,NA,NA,NA,NA,NA,NA,NA,NA,NA,NA,NA,NA,NA,NA,NA,NA,0,,"Aquatic insects, crustaceans, small fish, and earthworms",,,,,NA,captive,2,0,0,1,1,0,1,1,1,TRUE
50,craseonycteris_thonglongyai,Kitti's Hog-nosed Bat,Craseonycteris thonglongyai,NA,vs_HLcraTho1,4180,Craseonycteridae,,HLcraTho1,Craseonycteris_thonglongyai_CRASEONYCTERIDAE_CHIROPTERA,Craseonycteris_thonglongyai,HLcraTho1,-,NA,Insectivore,Insectivore,100,0,0,0,0,0,0,0,0,0,Ref_1,ABC,A,A,,1,0,0,Ref_1,ABC,2.15,Ref_117,1,1,0,0,1,0,0,0,0,0,0,0,0,0,0,Insectivore,0,N/A,NA,1,0,0,0,1,NA,NA,NA,NA,NA,NA,NA,NA,NA,NA,NA,NA,NA,NA,NA,NA,NA,NA,NA,NA,0,Species,"prey insects can be found, insects probably were seized directly with the mouth, the stomach contents of one specimen consisted of the fragments of small insects and a spider",,,,,NA,wild,0,0,1,1,1,0,0,1,0,FALSE
51,cricetomys_gambianus,African Giant Pouched Rats,Cricetomys gambianus,NA,vs_HLcriGam1,1337,Nesomyidae,,HLcriGam1,Cricetomys_gambianus_NESOMYIDAE_RODENTIA,Cricetomys_gambianus,HLcriGam1,-,NA,Generalist,_Omnivore,40,0,0,0,0,0,30,0,20,10,Ref_1,ABC,G,A,,1,0,0,Ref_1,ABC,1271,Ref_117,1,0,0,0,1,0,1,0,0,0,0,0,1,0,0,Generalist,0,0,NA,NA,0,0,0,1,NA,NA,NA,NA,NA,NA,NA,NA,NA,NA,NA,NA,NA,NA,NA,NA,NA,NA,NA,NA,0,Genus,"Ajayi stated that these rats are completely omnivorous, feeding on vegetables, insects, crabs, snails, and other items but apparently preferring palm fruits and palm kernels. According to Kindon, these rats store a considerable amounmt of food as well as many nonedible items, such as coins, metal, and bits of cloth.",,,,,NA,wild,0,0,0,0,1,0,0,0,0,FALSE
52,cricetulus_griseus,Chinese hamster,Cricetulus griseus,criGri1,vs_HLcriGri3,NA,NA,criGri1,HLcriGri3,NA,Cricetulus_griseus,HLcriGri3,-,Herbivore,Herbivore,Herbivore,NA,NA,NA,NA,NA,NA,NA,NA,NA,NA,NA,NA,NA,NA,NA,NA,NA,NA,NA,NA,NA,NA,NA,0,0,0,1,0,1,1,0,0,0,0,0,0,0,Herbivore,0,0,0,NA,0,0,0,1,NA,NA,NA,NA,NA,NA,NA,NA,NA,NA,NA,NA,NA,NA,NA,NA,NA,NA,NA,NA,0,Genus,"Diet consists of young shoots and seeds. Preferred items are soybeans, peas, and millet seeds. Insects are taken. Captives killed and ate frogs and jerboas. Captives excluded from annotations. ",,,,,NA,captive,2,0,0,0,1,1,0,0,1,TRUE
53,crocidura_indochinensis,White-toothed Shrews,Crocidura indochinensis,NA,NA,3388,Soricidae,,NA,Crocidura_indochinensis_SORICIDAE_EULIPOTYPHLA,Crocidura_indochinensis,NA,-,NA,Carnivore,Carnivore,50,0,10,0,0,40,0,0,0,0,Ref_2,D1,G,A,,1,0,0,Ref_1,ABC,10.42,"Ref_2, Ref_3",0,1,1,0,0,1,0,0,0,0,0,0,0,0,0,Carnivore,1,1,1,NA,0,0,0,1,NA,NA,NA,NA,NA,NA,NA,NA,NA,NA,NA,NA,NA,NA,NA,NA,NA,NA,NA,NA,0,Genus,"The diet of Crocidura consists of invertebrates and the bodies of freshly killed animals. In captivity many species will consume all but the skin, tail, and parts of the libs of a small mammal; the brain is always eaten first. They also feed on frogs, toads, and lizards. ",,,,,NA,NA,NA,NA,0,1,1,0,1,1,0,FALSE
54,cryptoprocta_ferox,Fossa,Cryptoprocta ferox,NA,vs_HLcryFer2,4866,Eupleridae,,HLcryFer2,Cryptoprocta_ferox_EUPLERIDAE_CARNIVORA,Cryptoprocta_ferox,HLcryFer2,-,NA,Carnivore,Carnivore,10,70,20,0,0,0,0,0,0,0,Ref_9,ABC,S,A,,1,1,0,Ref_1,ABC,9500,Ref_117,1,1,1,0,1,0,0,0,0,0,0,0,0,0,0,Carnivore,1,1,1,NA,0,0,0,1,NA,NA,NA,NA,NA,NA,NA,NA,NA,NA,NA,NA,NA,NA,NA,NA,NA,NA,NA,NA,0,Species,"Its diet consists mainly of small mammals and birds but also includes reptiles, frogs, and insects",,,,,NA,captive,2,0,0,1,1,0,1,1,0,FALSE
55,ctenodactylus_gundi,Gundi,Ctenodactylus gundi,NA,vs_HLcteGun1,2833,Ctenodactylidae,,HLcteGun1,Ctenodactylus_gundi_CTENODACTYLIDAE_RODENTIA,Ctenodactylus_gundi,HLcteGun1,-,NA,Herbivore,Herbivore,0,0,0,0,0,0,0,0,0,100,Ref_1,ABC,G,A,,0,0,1,Ref_1,ABC,289,Ref_117,1,0,0,0,0,0,1,0,0,0,0,0,0,0,0,Herbivore,0,0,0,0,0,0,0,1,NA,NA,NA,NA,NA,NA,NA,NA,NA,NA,NA,NA,NA,NA,NA,NA,NA,NA,NA,NA,0,Genus,These rodents seem to feed solely on plant material. ,,,,,NA,wild,0,0,0,0,1,1,0,0,0,FALSE
56,ctenomys_sociabilis,Tuco tuco,Ctenomys sociabilis,NA,vs_HLcteSoc1,2921,Ctenomyidae,,HLcteSoc1,Ctenomys_sociabilis_CTENOMYIDAE_RODENTIA,Ctenomys_sociabilis,HLcteSoc1,-,NA,Herbivore,Herbivore,0,0,0,0,0,0,0,0,0,100,Ref_2,D1,G,A,,0,1,1,Ref_1,ABC,400,Ref_117,1,0,0,0,0,0,1,0,0,0,0,0,0,0,0,Herbivore,0,0,0,0,0,0,0,1,NA,NA,NA,NA,NA,NA,NA,NA,NA,NA,NA,NA,NA,NA,NA,NA,NA,NA,NA,NA,0,Genus,"Some food, in the form of roots, stems, and grass, is probably pulled into the burrows from below.... The diet is thought to be entirely vegetarian. ",,,,,NA,captive,2,0,0,0,1,1,0,0,0,FALSE
57,cuniculus_paca,Pacas,Cuniculus paca,NA,NA,3073,Cuniculidae,,NA,Cuniculus_paca_CUNICULIDAE_RODENTIA,Cuniculus_paca,NA,-,NA,Herbivore,Herbivore,0,0,0,0,0,0,20,0,30,50,Ref_1,ABC,G,A,,1,0,0,Ref_1,ABC,8172.55,Ref_58,1,0,0,1,0,0,1,0,0,0,0,0,0,0,0,Herbivore,0,0,0,0,0,0,0,1,NA,NA,NA,NA,NA,NA,NA,NA,NA,NA,NA,NA,NA,NA,NA,NA,NA,NA,NA,NA,0,Genus,"Also called Agouti paca; Their diet consists of leaves, stems, roots, seeds, and fallen fruit. ",,,,,NA,wild,0,0,0,0,1,1,0,0,0,FALSE
58,dasyprocta_punctata,Agouti,Dasyprocta punctata,NA,vs_HLdasPun1,3068,Dasyproctidae,,HLdasPun1,Dasyprocta_punctata_DASYPROCTIDAE_RODENTIA,Dasyprocta_punctata,HLdasPun1,-,NA,Omnivore,_Omnivore,10,0,0,0,0,0,40,0,0,50,Ref_1,ABC,G,A,,0,1,1,Ref_1,ABC,2674.98,Ref_117,1,0,0,1,1,0,1,1,0,0,0,0,0,0,0,Omnivore,0,0,NA,NA,0,0,0,1,NA,NA,NA,NA,NA,NA,NA,NA,NA,NA,NA,NA,NA,NA,NA,NA,NA,NA,NA,NA,0,Genus,"The diet consists of fruits, vegetables and various succulent plants. D. punctata also sometimes browsed and ate crabs. ",,,,,NA,captive,2,0,0,0,1,0,0,0,0,FALSE
59,dasypus_novemcinctus,Armadillo,Dasypus novemcinctus,dasNov3,vs_dasNov3,420,Dasypodidae,dasNov3,dasNov3,Dasypus_novemcinctus_DASYPODIDAE_CINGULATA,Dasypus_novemcinctus,dasNov3,-,Insectivore/Carnivore,Insectivore/Carnivore,Carnivore,100,0,0,0,0,0,0,0,0,0,Ref_1,ABC,G,A,,1,0,0,Ref_1,ABC,4203.78,Ref_117,1,0,1,0,1,0,0,0,0,0,0,0,0,0,0,Insectivore/Carnivore,0,1,NA,1,0,0,0,1,NA,NA,NA,NA,NA,NA,NA,NA,NA,NA,NA,NA,NA,NA,NA,NA,NA,NA,NA,NA,0,,"arthropods, small reptiles, and amphibians, animal matter, insects such as beetles and ants",,,,,NA,NA,NA,NA,0,0,1,0,1,1,1,TRUE
60,daubentonia_madagascariensis,Aye-ayes,Daubentonia madagascariensis,NA,vs_HLdauMad1,528,Daubentoniidae,,HLdauMad1,Daubentonia_madagascariensis_DAUBENTONIIDAE_PRIMATES,Daubentonia_madagascariensis,HLdauMad1,-,NA,Omnivore-IH,_Omnivore,40,0,0,0,0,0,0,20,40,0,Ref_1,ABC,Ar,A,,1,0,0,Ref_1,ABC,2500,Ref_117,1,0,0,1,1,0,1,0,1,0,0,0,0,0,0,Insectivore/Herbivore,0,0,NA,NA,0,0,0,1,NA,NA,NA,NA,NA,NA,NA,NA,NA,NA,NA,NA,NA,NA,NA,NA,NA,NA,NA,NA,0,Genus,"The main foods there were seeds from the fruit of Canarium, cankerous growths on Intsia, nectar from Ravenala, and larve from several families of insects. The aye-aye also eats coconuts...Other studies on Nosy Mangabe Island, where the aye-aye was introduced in 1967, indicates that the diet also includes bamboo, tree exudates, large insects, and possibly small invertebrates. Italicized information omitted from analysis because it was a result of reintroduction, like captivity. ",,,,,NA,wild,0,0,0,0,1,1,0,1,0,FALSE
61,delphinapterus_leucas,Beluga Whale,Delphinapterus leucas,HLdelLeu1,vs_HLdelLeu2,5382,Monodontidae,delLeu1,HLdelLeu2,Delphinapterus_leucas_MONODONTIDAE_CETARTIODACTYLA,Delphinapterus_leucas,HLdelLeu2,-,Piscivore,Piscivore,Piscivore,40,0,0,60,0,0,0,0,0,0,Ref_1,ABC,M,A,,1,1,1,Ref_3,D2,1360000,Ref_117,1,1,0,0,0,0,0,0,0,0,0,0,1,1,0,Piscivore,0,1,1,NA,1,1,1,0,NA,NA,NA,NA,NA,NA,NA,NA,NA,NA,NA,NA,NA,NA,NA,NA,NA,NA,NA,NA,0,Species,"The diet includes a great variety of fish, such as cod and herring, as well as octopus, squid, brabs, and snails",,,,,NA,captive,2,0,1,1,1,0,1,1,1,TRUE
62,delphinus_delphis,Dolphin,Delphinus delphis,NA,NA,5353,Delphinidae,,NA,Delphinus_delphis_DELPHINIDAE_CETARTIODACTYLA,NA,NA,-,NA,NA,NA,80,0,0,20,0,0,0,0,0,0,Ref_1,ABC,M,A,,1,1,0,Ref_115,ABC,80000,Ref_117,1,NA,NA,NA,NA,NA,NA,NA,NA,NA,NA,NA,NA,NA,NA,NA,NA,,NA,NA,NA,NA,NA,NA,NA,NA,NA,NA,NA,NA,NA,NA,NA,NA,NA,NA,NA,NA,NA,NA,NA,NA,NA,NA,NA,,,,,,,NA,NA,NA,NA,1,NA,1,0,0,0,0,FALSE
63,desmodus_rotundus,Common Vampire Bat,Desmodus rotundus,HLdesRot1,vs_HLdesRot2,4129,Phyllostomidae,desRot1,HLdesRot2,Desmodus_rotundus_PHYLLOSTOMIDAE_CHIROPTERA,Desmodus_rotundus,HLdesRot2,-,NA,Hematophagy ,Hematophagy,0,100,0,0,0,0,0,0,0,0,Ref_1,ABC,G,A,,1,0,0,Ref_1,ABC,31.21,Ref_117,1,1,0,0,0,0,0,0,0,0,0,0,0,0,0,Hematophagy ,0,1,NA,NA,0,0,0,1,NA,NA,NA,NA,NA,NA,NA,NA,NA,NA,NA,NA,NA,NA,NA,NA,NA,NA,NA,NA,0,Species,"The feeding habits of the vampire have been so exaggerated and confused with Old World legends that the animal is of particular interest. Its usual food is the blood of horses, burros, cattle, and occasionally human beings. Data summarized by Gardner indicate that in some areas Desmodus also preys extensively on domestic turkeys and chickens. ",,,,,NA,captive,2,0,1,1,1,0,0,0,0,FALSE
64,dicerorhinus_sumatrensis,Sumatran Rhinoceros,Dicerorhinus sumatrensis,NA,vs_HLdicSum1,5091,Rhinocerotidae,,HLdicSum1,Dicerorhinus_sumatrensis_RHINOCEROTIDAE_PERISSODACTYLA,Dicerorhinus_sumatrensis,HLdicSum1,-,NA,Herbivore,Herbivore,0,0,0,0,0,0,50,0,0,50,Ref_1,ABC,G,A,,1,0,0,Ref_1,ABC,1266667,Ref_117,1,1,0,1,0,0,1,1,0,0,0,0,0,0,0,Herbivore,0,0,0,0,0,0,0,1,NA,NA,NA,NA,NA,NA,NA,NA,NA,NA,NA,NA,NA,NA,NA,NA,NA,NA,NA,NA,0,Species,"The diet includes fruit, leaves, twigs, and bark. Favored foods are wild mangoes, figs, bamboo, and all kinds of plants found in secondary growth. Cultivated crops sometimes are eaten. ",,,,,NA,wild,0,0,0,1,1,1,0,0,0,FALSE
65,diceros_bicornis,Black Rhinoceros,Diceros bicornis,NA,vs_HLdicBic1,5092,Rhinocerotidae,,HLdicBic1,Diceros_bicornis_RHINOCEROTIDAE_PERISSODACTYLA,Diceros_bicornis,HLdicBic1,-,NA,Herbivore,Herbivore,0,0,0,0,0,0,0,0,0,100,Ref_1,ABC,G,A,,1,1,0,Ref_1,ABC,1180510.9,Ref_117,1,1,0,0,0,0,1,0,0,0,0,0,0,0,0,Herbivore,0,0,0,0,0,0,0,1,NA,NA,NA,NA,NA,NA,NA,NA,NA,NA,NA,NA,NA,NA,NA,NA,NA,NA,NA,NA,0,Species,"Diceros is a browser, its main foods being the thin regenerating twigs of woody growth and legumes. A great variety of plant species are utilized, through acacias seem to be a favorite. ",,,,,NA,wild,0,0,0,1,1,1,0,0,0,FALSE
66,dinomys_branickii,Pacarana,Dinomys branickii,NA,vs_HLdinBra1,3040,Dinomyidae,,HLdinBra1,Dinomys_branickii_DINOMYIDAE_RODENTIA,Dinomys_branickii,HLdinBra1,-,NA,Herbivore,Herbivore,0,0,0,0,0,0,40,0,0,60,Ref_1,ABC,G,A,,1,0,0,Ref_1,ABC,12500,Ref_117,1,0,0,1,0,0,1,0,0,0,0,0,0,0,0,Herbivore,0,0,0,0,0,0,0,1,NA,NA,NA,NA,NA,NA,NA,NA,NA,NA,NA,NA,NA,NA,NA,NA,NA,NA,NA,NA,0,Species,"Diet consists mainly of fruits, leaves, and tender stems",,,,,NA,NA,NA,NA,0,0,1,1,0,0,0,FALSE
67,dipodomys_ordii,Ord Kangaroo Rat,Dipodomys ordii,HLdipOrd2,vs_dipOrd2,1195,Heteromyidae,dipOrd2,dipOrd2,Dipodomys_ordii_HETEROMYIDAE_RODENTIA,Dipodomys_ordii,dipOrd2,-,Insectivore/herbivore,Omnivore-IH,_Omnivore,20,0,0,0,0,0,20,0,30,30,Ref_1,ABC,G,A,,1,0,0,Ref_1,ABC,60.4,Ref_117,1,0,0,1,1,0,1,1,0,0,0,0,0,0,0,Insectivore/herbivore,0,0,NA,NA,0,0,0,1,NA,NA,NA,NA,NA,NA,NA,NA,NA,NA,NA,NA,NA,NA,NA,NA,NA,NA,NA,NA,0,Genus,"The diet of Dipodomys includes seeds, some fruits, leaves, stems, buds, and insects.",,,,,NA,NA,NA,NA,0,0,1,0,0,1,1,TRUE
68,dipodomys_stephensi,Stephens Kangaroo Rat,Dipodomys stephensi,NA,vs_HLdipSte1,1200,Heteromyidae,,HLdipSte1,Dipodomys_stephensi_HETEROMYIDAE_RODENTIA,Dipodomys_stephensi,HLdipSte1,-,NA,Omnivore-IH,_Omnivore,20,0,0,0,0,0,20,0,30,30,Ref_1,ABC,G,A,,1,0,0,Ref_1,ABC,69.75,Ref_117,1,0,0,1,1,0,1,1,0,0,0,0,0,0,0,Insectivore/herbivore,0,0,NA,NA,0,0,0,1,NA,NA,NA,NA,NA,NA,NA,NA,NA,NA,NA,NA,NA,NA,NA,NA,NA,NA,NA,NA,0,Genus,"The diet of Dipodomys includes seeds, some fruits, leaves, stems, buds, and insects.",,,,,NA,NA,NA,NA,0,0,1,0,0,1,0,FALSE
69,dolichotis_patagonum,Patagonian cavy,Dolichotis patagonum,NA,vs_HLdolPat1,3054,Caviidae,,HLdolPat1,Dolichotis_patagonum_CAVIIDAE_RODENTIA,Dolichotis_patagonum,HLdolPat1,-,NA,Herbivore,Herbivore,0,0,0,0,0,0,0,0,0,100,Ref_1,ABC,G,A,,0,0,1,Ref_1,ABC,8000,Ref_117,1,0,0,0,0,0,1,0,0,0,0,0,0,0,0,Herbivore,0,0,0,0,0,0,0,1,NA,NA,NA,NA,NA,NA,NA,NA,NA,NA,NA,NA,NA,NA,NA,NA,NA,NA,NA,NA,0,Genus,The diet consists of any available vegetation,,,,,NA,captive,2,0,0,0,1,1,0,0,0,FALSE
70,echinops_telfairi,Tenrec,Echinops telfairi,echTel2,vs_echTel2,362,Tenrecidae,echTel2,echTel2,Echinops_telfairi_TENRECIDAE_AFROSORICIDA,Echinops_telfairi,echTel2,-,Ambiguous,Ambiguous,Ambiguous,60,0,0,0,0,0,40,0,0,0,Ref_40,ABC,G,A,,1,0,0,Ref_1,ABC,180,Ref_117,1,0,1,1,1,0,1,0,0,0,0,0,0,0,0,Ambiguous,0,NA,NA,NA,0,0,0,1,NA,NA,NA,NA,NA,NA,NA,NA,NA,NA,NA,NA,NA,NA,NA,NA,NA,NA,NA,NA,0,,"forages in trees and on the ground; captives-animal food, insects, mice, chopped meat",,,,,NA,captive,2,0,0,0,1,0,0,0,0,FALSE
71,eidolon_helvum,Straw-colored Fruit Bats,Eidolon helvum,NA,vs_HLeidHel2,3703,Pteropodidae,,HLeidHel2,Eidolon_helvum_PTEROPODIDAE_CHIROPTERA,Eidolon_helvum,HLeidHel2,-,NA,Herbivore,Herbivore,0,0,0,0,0,0,100,0,0,0,Ref_1,ABC,Ar,A,,1,1,1,Ref_1,ABC,253.31,Ref_117,1,1,0,1,0,0,1,0,1,0,0,0,0,0,0,Herbivore,0,0,0,0,0,0,0,1,NA,NA,NA,NA,NA,NA,NA,NA,NA,NA,NA,NA,NA,NA,NA,NA,NA,NA,NA,NA,0,Genus,"Juices of various fruits are the preferred food, though this bat also feeds on the blossoms and perhaps young shoots of the silk-cotton tree. Eidolon will eat directly into the fruit of the palm Borasssus and has the unusual habit of chewing into soft wood, apparently to obtain moisture",,,no ,ARG,NA,wild,0,0,0,1,1,1,0,0,0,FALSE
72,elaphurus_davidianus,Pere David's Deer,Elaphurus davidianus,NA,vs_HLelaDav1,5311,Cervidae,,HLelaDav1,Elaphurus_davidianus_CERVIDAE_CETARTIODACTYLA,Elaphurus_davidianus,HLelaDav1,-,NA,Herbivore,Herbivore,0,0,0,0,0,0,0,0,0,100,Ref_1,ABC,G,A,,0,1,1,Ref_3,D2,149000,Ref_117,1,1,0,0,0,0,1,0,0,0,0,0,0,0,0,Herbivore,0,0,0,0,0,0,0,1,NA,NA,NA,NA,NA,NA,NA,NA,NA,NA,NA,NA,NA,NA,NA,NA,NA,NA,NA,NA,0,Species,"Although it supplements its grass diet with water plants in the summer, it is essentially a grazing animal. ",,,,,NA,captive,2,0,0,1,1,1,0,0,0,FALSE
73,elephantulus_edwardii,Cape elephant shrew,Elephantulus edwardii,eleEdw1,vs_eleEdw1,390,Macroscelididae,eleEdw1,eleEdw1,Elephantulus_edwardii_MACROSCELIDIDAE_MACROSCELIDEA,Elephantulus_edwardii,eleEdw1,-,Insectivore,Insectivore,Insectivore,100,0,0,0,0,0,0,0,0,0,Ref_1,ABC,G,A,,0,0,1,Ref_1,ABC,48,Ref_117,1,0,0,0,1,0,0,0,0,0,NA,0,0,0,0,Insectivore,0,N/A,NA,1,0,0,0,1,NA,NA,NA,NA,NA,NA,NA,NA,NA,NA,NA,NA,NA,NA,NA,NA,NA,NA,NA,NA,0,Genus,"Insects, ants, and termites, in captivity- fruits and veggies",,,,,NA,wild,0,0,0,0,1,0,0,1,1,TRUE
74,ellobius_lutescens,Transcaucasian mole vole,Ellobius lutescens,NA,vs_HLellLut1,1465,Cricetidae,,HLellLut1,NA,Ellobius_lutescens,HLellLut1,-,NA,Herbivore,Herbivore,0,0,0,0,0,0,0,0,0,100,Ref_1,ABC,G,A,,1,0,0,Ref_3,D2,117.31,Ref_117,1,0,0,0,0,0,1,0,0,0,0,0,0,0,0,Herbivore,0,0,0,0,0,0,0,1,NA,NA,NA,NA,NA,NA,NA,NA,NA,NA,NA,NA,NA,NA,NA,NA,NA,NA,NA,NA,0,Genus,They feed on underground parts of plants; tulip bulbs and pulpy tubers are especially favored. ,,,,,NA,captive,2,0,0,0,1,1,0,0,0,FALSE
75,ellobius_talpinus,Northern Mole Vole,Ellobius talpinus,NA,vs_HLellTal1,1463,Cricetidae,,HLellTal1,Ellobius_talpinus_CRICETIDAE_RODENTIA,Ellobius_talpinus,HLellTal1,-,NA,Herbivore,Herbivore,0,0,0,0,0,0,0,0,0,100,Ref_1,ABC,G,A,,1,0,0,Ref_3,D2,40,Ref_117,1,0,0,0,0,0,1,0,0,0,0,0,0,0,0,Herbivore,0,0,0,0,0,0,0,1,NA,NA,NA,NA,NA,NA,NA,NA,NA,NA,NA,NA,NA,NA,NA,NA,NA,NA,NA,NA,0,Genus,They feed on underground parts of plants; tulip bulbs and pulpy tubers are especially favored. ,,,,,NA,captive,2,0,0,0,1,1,0,0,0,FALSE
76,enhydra_lutris,Sea Otter,Enhydra lutris,NA,vs_enhLutNer1,5015,Mustelidae,enhLut1,enhLutNer1,Enhydra_lutris_MUSTELIDAE_CARNIVORA,Enhydra_lutris,enhLutNer1,-,NA,Insectivore/Piscivore,Insectivore,50,0,0,50,0,0,0,0,0,0,Ref_1,ABC,M,A,,0,1,1,Ref_58,ABC,23500,Ref_117,1,1,0,0,1,0,0,0,0,0,0,0,1,1,0,Insectivore/Piscivore,0,1,1,NA,0.5,NA,NA,NA,NA,NA,NA,NA,NA,NA,NA,NA,NA,NA,NA,NA,NA,NA,NA,NA,NA,NA,NA,NA,0,Species,"The diet consists mainly of slow-moving fish and marine invertebrates, such as sea urchins, abaone, crabs, and mollusks",,,,,NA,wild,0,0,0,1,1,0,1,1,0,FALSE
77,eptesicus_fuscus,Big brown bat,Eptesicus fuscus,eptFus1,vs_eptFus1,4353,Vespertilionidae,eptFus1,eptFus1,Eptesicus_fuscus_VESPERTILIONIDAE_CHIROPTERA,Eptesicus_fuscus,eptFus1,-,Insectivore,Insectivore,Insectivore,100,0,0,0,0,0,0,0,0,0,Ref_1,ABC,A,A,,1,0,0,Ref_1,ABC,16.46,Ref_117,1,1,0,0,1,0,0,0,0,0,0,0,0,0,0,Insectivore,0,N/A,NA,1,0,0,0,1,NA,NA,NA,NA,NA,NA,NA,NA,NA,NA,NA,NA,NA,NA,NA,NA,NA,NA,NA,NA,0,Genus,The diet of Eptesicus consists of insects,,,,,NA,wild,0,0,1,1,1,0,0,1,1,TRUE
78,equus_asinus,Wild Donkey,Equus asinus,HLequAsi1,vs_HLequAsiAsi2,5083,Equidae,equAsi1,HLequAsiAsi2,NA,Equus_asinus,HLequAsiAsi2,-,Herbivore,Herbivore,Herbivore,0,0,0,0,0,0,0,0,0,100,Ref_1,ABC,G,A,,1,1,1,Ref_1,ABC,244999.25,Ref_117,1,1,0,0,0,0,1,0,0,0,0,0,0,0,0,Herbivore,0,0,0,0,0,0,0,1,NA,NA,NA,NA,NA,NA,NA,NA,NA,NA,NA,NA,NA,NA,NA,NA,NA,NA,NA,NA,0,Genus,"diet to include 22 percent grasses and sedges, 33 percent forbs, and 40 percent browse",,,,,NA,domestic,1,1,0,1,1,1,0,0,1,TRUE
79,equus_caballus,Horse,Equus caballus,HLequCab3,vs_equCab3,5082,Equidae,equCab2,equCab3,Equus_caballus_EQUIDAE_PERISSODACTYLA,Equus_caballus,equCab3,-,Herbivore,Herbivore,Herbivore,0,0,0,0,0,0,0,0,0,100,Ref_1,ABC,G,A,,1,1,1,Ref_1,ABC,250000,Ref_117,1,1,0,0,0,0,1,0,0,0,0,0,0,0,0,Herbivore,0,0,0,0,0,0,0,1,NA,NA,NA,NA,NA,NA,NA,NA,NA,NA,NA,NA,NA,NA,NA,NA,NA,NA,0.65,532,0,Species,"Horses are primarily grazers, taking mainly grasses and low forage plants.",,,,,NA,domestic,1,1,0,1,1,1,0,0,1,TRUE
80,equus_przewalskii,Przewalskii Horse,Equus przewalskii,equPrz1,vs_equPrz1,NA,NA,equPrz1,equPrz1,NA,Equus_przewalskii,equPrz1,-,Herbivore,Herbivore,Herbivore,NA,NA,NA,NA,NA,NA,NA,NA,NA,NA,NA,NA,NA,NA,NA,NA,NA,NA,NA,NA,NA,NA,NA,1,0,0,0,0,1,0,0,0,0,0,0,0,0,Herbivore,0,0,0,0,0,0,0,1,NA,NA,NA,NA,NA,NA,NA,NA,NA,NA,NA,NA,NA,NA,NA,NA,NA,NA,NA,NA,0,Species,No specific information on Prewalskii. Wilson and Reeder 1993 regarded caballus and przewalskii as conspecific. Information here is from caballus,,,,,NA,captive,2,0,0,1,1,1,0,0,1,TRUE
81,erinaceus_europaeus,Hedgehog,Erinaceus europaeus,eriEur2,vs_eriEur2,3222,Erinaceidae,eriEur2,eriEur2,Erinaceus_europaeus_ERINACEIDAE_EULIPOTYPHLA,Erinaceus_europaeus,eriEur2,-,Generalist,Generalist,_Omnivore,80,10,10,0,0,0,0,0,0,0,Ref_1,ABC,G,A,,1,0,0,Ref_1,ABC,771,Ref_117,1,1,1,1,0,1,0,0,0,1,0,0,0,0,0,Generalist,0,1,NA,NA,0,0,0,1,NA,NA,NA,NA,NA,NA,NA,NA,NA,NA,NA,NA,NA,NA,NA,NA,NA,NA,0.00335,2.5,0,,"Invertebrates, frogs, snakes, lizards, and young birds and miceâ€¦ nearly anything, including carrion",,,,,NA,NA,NA,NA,0,1,1,0,0,0,1,TRUE
82,erythrocebus_patas,Red Guenon,Erythrocebus patas,NA,vs_HLeryPat1,744,Cercopithecidae,,HLeryPat1,Erythrocebus_patas_CERCOPITHECIDAE_PRIMATES,Erythrocebus_patas,HLeryPat1,-,NA,Omnivore,_Omnivore,0,0,0,0,0,0,40,0,20,40,Ref_1,ABC,G,A,,0,0,1,Ref_1,ABC,8090,Ref_117,1,0,1,1,1,0,1,1,0,1,1,0,0,0,0,Omnivore,0,1,NA,NA,0,0,0,1,NA,NA,NA,NA,NA,NA,NA,NA,NA,NA,NA,NA,NA,NA,NA,NA,NA,NA,NA,NA,0,Species,"The bulk of the diet consists of grasses, berries, fruits, beans, and seeds, occasionally supplemented by mushrooms, ants, grasshoppers, lizards, and birds' eggs",,,,,NA,captive,2,0,0,0,1,0,0,0,0,FALSE
83,eschrichtius_robustus,Gray Whale,Eschrichtius robustus,NA,vs_HLescRob1,5346,Eschrichtiidae,,HLescRob1,Eschrichtius_robustus_ESCHRICHTIIDAE_CETARTIODACTYLA,Eschrichtius_robustus,HLescRob1,-,Planktivore,Planktivore,Planktivore,90,0,0,10,0,0,0,0,0,0,Ref_1,ABC,M,A,,0,1,1,Ref_58,ABC,28500000,Ref_117,1,1,0,0,1,1,0,0,0,0,0,0,1,1,0,Planktivore,0,1,NA,NA,1,1,1,0,NA,NA,NA,NA,NA,NA,NA,NA,NA,NA,NA,NA,NA,NA,NA,NA,NA,NA,NA,NA,0,Genus,"The diet consists mainly of gammaridean amphipods (small crustacean). Other crustaceans, certain mollusks, and worms and small fish are also eaten. ",,,,,NA,wild,0,0,0,1,1,0,1,1,0,FALSE
84,eubalaena_japonica,North Atlantic Right Whale,Eubalaena japonica,NA,vs_HLeubJap1,5338,Balaenidae,,HLeubJap1,Eubalaena_japonica_BALAENIDAE_CETARTIODACTYLA,Eubalaena_japonica,HLeubJap1,-,Planktivore,Planktivore,Planktivore,100,0,0,0,0,0,0,0,0,0,Ref_26,ABC,M,A,,1,1,1,Ref_1,ABC,2.30E+07,"Ref_2, Ref_3",0,1,0,0,1,0,0,0,0,0,0,0,1,1,0,Planktivore,0,1,NA,NA,1,1,1,0,NA,NA,NA,NA,NA,NA,NA,NA,NA,NA,NA,NA,NA,NA,NA,NA,NA,NA,NA,NA,0,Genus,"It's diet consists mainly of copepods and also includes euphausiids, pteropods, and small fish",,,,,NA,wild,0,0,0,1,1,0,1,1,0,FALSE
85,eulemur_flavifrons,Lemur,Eulemur flavifrons,NA,vs_HLeulFla1,NA,NA,,HLeulFla1,Eulemur_flavifrons_LEMURIDAE_PRIMATES,Eulemur_flavifrons,HLeulFla1,-,NA,Herbivore,Herbivore,NA,NA,NA,NA,NA,NA,NA,NA,NA,NA,NA,NA,NA,NA,NA,NA,NA,NA,NA,NA,NA,NA,NA,0,0,1,0,0,1,0,0,0,0,0,0,0,0,Herbivore,0,0,0,0,0,0,0,1,NA,NA,NA,NA,NA,NA,NA,NA,NA,NA,NA,NA,NA,NA,NA,NA,NA,NA,0.0267,2.25,0,Genus,"The diet of Eulemur consists largely of flowers, fruits, and leaves. E. macaco also is known to eat bark, and E. mongoz feeds extensively on nectar. Captive E. macaco will accept meat. Captives excluded from analysis",,,no,ARG,NA,captive,2,0,0,0,1,1,0,0,0,FALSE
86,eulemur_fulvus,Lemur,Eulemur fulvus,NA,vs_HLeulFul1,496,Lemuridae,,HLeulFul1,Eulemur_fulvus_LEMURIDAE_PRIMATES,Eulemur_fulvus,HLeulFul1,-,NA,Herbivore,Herbivore,0,0,0,0,0,0,30,0,0,70,Ref_1,ABC,Ar,A,,0,0,1,Ref_1,ABC,3150,Ref_117,1,0,0,1,0,0,1,0,0,0,0,0,0,0,0,Herbivore,0,0,0,0,0,0,0,1,NA,NA,NA,NA,NA,NA,NA,NA,NA,NA,NA,NA,NA,NA,NA,NA,NA,NA,NA,NA,0,Genus,"The diet of Eulemur consists largely of flowers, fruits, and leaves. E. macaco also is known to eat bark, and E. mongoz feeds extensively on nectar. Captive E. macaco will accept meat. Captives excluded from analysis",,,no,ARG,NA,captive,2,0,0,0,1,1,0,0,0,FALSE
