,Scientific_Binomial,CommonName,ScientificNameFull,HillerName,Zoonomia,MSW3_ID,MSWFamilyLatin,Genome,Assembly_Name,uphamName,foleyTip,TogaTreeName,Divider,Meyer.Diet.Categorical,Meyer.Lab.Classification.Clean,Meyer.Lab.Classification.Compressed,Diet.Inv,Diet.Vend,Diet.Vect,Diet.Vfish,Diet.Vunk,Diet.Scav,Diet.Fruit,Diet.Nect,Diet.Seed,Diet.PlantO,Diet.Source,Diet.Certainty,ForStrat.Value,ForStrat.Certainty,ForStrat.Comment,Activity.Nocturnal,Activity.Crepuscular,Activity.Diurnal,Activity.Source,Activity.Certainty,BodyMass.Value,BodyMass.Source,BodyMass.SpecLevel,Laurasiatheria,Secondary_Terrestrial_Vertebrate,Secondary_Frugivore,Secondary_Arthropoda,Secondary_Terrestrial_Invertebrate,Secondary_Vegetation..leaves..browse..bulbs..grass..etc..,Secondary_Granivore..seeds.,Secondary_Veg_Exudants,Secondary_eggs,Secondary_fungi,Secondary_lichen,Secondary_Mollusks,Secondary_fish,Secondary_Marine_Mammals,Meyer.Lab.Classification,True_carn_v_all,Vert_v_herb,CarnFish_Herbs,Ins_v_herbs,MarineAquatic,MarineAquaticBinary,MarineSemiaquaticBinary,PON1Fx,X..Protein..Spring.,X..Protein..Fall.,X..Protein..Winter.,X..Protein..Summer.,X..Lipids..Summer.,X..Lipids..Fall.,X..Lipids..Spring.,X..Lipids..Winter.,X..Carbohydrate..Fall.,X..Carbohydrate..Summer.,X..Carbohydrate..Spring.,X..Carbohydrate..Winter.,Carbohydrate...mean.,Carb..SE.,Lipid.,Lipid..SE.,Protein.,Protein..SE.,Brain.mass..in.kg.,Body.mass..in.kg.,Another.set.of.eyes.,Level.of.Description..Order..Genus..Species.,NowakNotes,NutritionalGeometryNotes,NutritionalGeometryRef,Did.you.find.any.data.articles.for.this.species.,Initials.for.who.inputed.data,GeneralNotes,Domestication,DomesticationNumeric,DomesticationBinary,Echolocation,LaurasiatheriaFilter,NoAoudad,HerbBinary,CarnBinary,CarnInsectBinary,HillerZoonomiaOverlap,HillerZoonomiaOverlapLogical
1,acinonyx_jubatus,Cheetah,Acinonyx jubatus,HLaciJub1,vs_HLaciJub2,4791,Felidae,aciJub1,HLaciJub2,Acinonyx_jubatus_FELIDAE_CARNIVORA,Acinonyx_jubatus,HLaciJub2,-,Carnivore,Carnivore,Carnivore,0,100,0,0,0,0,0,0,0,0,Ref_1,ABC,G,A,,0,0,1,Ref_1,ABC,46700,Ref_117,1,1,1,0,0,0,0,0,0,0,0,0,0,0,0,Carnivore,1,1,1,NA,0,0,0,1,NA,NA,NA,NA,NA,NA,NA,NA,NA,NA,NA,NA,NA,NA,NA,NA,NA,NA,0.11,38.5,0,Species,"The diet consists mainly of gazelles... and also includes impalas, other small and medium-sized ungulates, and the calves of large ungulates...Hares, other small mammals, and birds are sometimes taken. ",,,,,NA,wild,0,0,0,1,1,0,1,1,1,TRUE
2,acomys_cahirinus,Spiny mouse,Acomys cahirinus,NA,vs_HLacoCah1,2063,Muridae,,HLacoCah1,Acomys_cahirinus_MURIDAE_RODENTIA,Acomys_cahirinus,HLacoCah1,-,NA,Omnivore,_Omnivore,0,0,0,0,30,0,0,0,0,70,Ref_1,ABC,G,A,,1,1,0,Ref_1,ABC,52.45,Ref_117,1,0,1,0,0,0,1,1,0,0,0,0,0,0,0,Omnivore,0,1,NA,NA,0,0,0,1,NA,NA,NA,NA,NA,NA,NA,NA,NA,NA,NA,NA,NA,NA,NA,NA,NA,NA,NA,NA,1,Genus,"Spiny mice are omnivorous but feed mainly on plant material, especially grains and grasses. Osborn and Helmy (1980:299) wrote that dates are a staple in some areas and that ""the dried flesh and bone marrow of mummified humans is a source of food for A. calririn11s in the tombs of Gebel Drunka southwest of Asyut.""",,,,,NA,captive,2,0,0,0,1,0,0,0,0,FALSE
3,ailuropoda_melanoleuca,Panda,Ailuropoda melanoleuca,ailMel1,vs_HLailMel2,5026,Ursidae,ailMel1,HLailMel2,Ailuropoda_melanoleuca_URSIDAE_CARNIVORA,Ailuropoda_melanoleuca,HLailMel2,-,Omnivore,Omnivore,_Omnivore,0,10,0,0,0,0,0,0,0,90,Ref_1,ABC,G,A,,1,1,0,Ref_1,ABC,108400,Ref_117,1,1,1,0,0,0,1,0,0,0,0,0,0,1,0,Omnivore,0,1,NA,NA,0,0,0,1,NA,NA,NA,NA,NA,NA,NA,NA,NA,NA,NA,NA,NA,NA,NA,NA,NA,NA,NA,NA,0,Species,"bamboo, gentians, irises, crocuses, tufted grasses, occassionally hunts for fish, pikas, and small rodents",,,,,NA,captive,2,0,0,1,1,0,0,0,1,TRUE
4,ailurus_fulgens,Red Panda ,Ailurus fulgens,HLailFul1,vs_HLailFul2,5077,Ailuridae,ailFul1,HLailFul2,Ailurus_fulgens_AILURIDAE_CARNIVORA,Ailurus_fulgens,HLailFul2,-,Omnivore,Omnivore,_Omnivore,10,10,0,0,0,0,10,0,10,60,Ref_1,ABC,G,A,,1,1,1,Ref_1,ABC,4900,Ref_117,1,1,0,1,1,0,1,1,0,1,0,0,0,0,0,Omnivore,0,0,NA,NA,0,0,0,1,NA,NA,NA,NA,NA,NA,NA,NA,NA,NA,NA,NA,69.4,NA,4.95,NA,23.95,NA,NA,NA,0,Species,"The diet consists mostly of bamboo sprouts, grasses, roots, fruits, and acorns. It also occasionally takes insects, eggs, young birds, and small rodents. ","The macronutrient bal- ance of the early-summer-leaves diet was 25.4 % crude pro- tein, 6.8 % fat, and 65.4 % available carbohydrate, while the winter-leaves diet had a balance of 22.5, 3.1, and 73.4 %, respectively. Differences in diet between sampling periods may reflect preferences associated with seasonal physiological demands.",,YES,ARG,NA,wild,0,0,0,1,1,0,0,0,1,TRUE
5,allactaga_bullata,Gobi jerboa,Allactaga bullata,NA,vs_HLallBul1,1262,Dipodidae,,HLallBul1,Allactaga_bullata_DIPODIDAE_RODENTIA,Allactaga_bullata,HLallBul1,-,NA,Omnivore-IH,_Omnivore,20,0,0,0,0,0,0,0,50,30,Ref_1,ABC,G,A,,1,0,0,Ref_1,ABC,89.35,Ref_178,2,0,0,0,0,0,0,1,0,0,0,0,0,0,0,Insectivore/herbivore,0,0,NA,NA,0,0,0,1,NA,NA,NA,NA,NA,NA,NA,NA,NA,NA,NA,NA,NA,NA,NA,NA,NA,NA,NA,NA,0,Genus,"No info on A. bullata. Genus info: Most species of Allactaga are primarily vegetarian. A. major  is almost exclusively a seed eater but also takes bulbs and some other plant matter. In contrast, A. sibirica is mainly insectivorous. ",,,,,NA,wild,0,0,0,0,1,0,0,1,0,FALSE
6,alouatta_palliata,Howler Monkey,Alouatta palliata,NA,vs_HLaloPal1,634,Atelidae,,HLaloPal1,Alouatta_palliata_ATELIDAE_PRIMATES,Alouatta_palliata,HLaloPal1,-,NA,Herbivore,Herbivore,0,0,0,0,0,0,40,0,0,60,Ref_1,ABC,Ar,A,,0,0,1,Ref_1,ABC,7274.95,Ref_117,1,0,0,1,0,0,1,0,0,0,0,0,0,0,0,Herbivore,0,0,0,0,0,0,0,1,NA,NA,NA,NA,NA,NA,NA,NA,NA,NA,NA,NA,NA,NA,NA,NA,NA,NA,NA,NA,0,Genus,"The diet of Alouatta is varied but consists mainly of leaves, fruits, and other vegetable matter.",,,,,NA,NA,NA,NA,0,0,1,1,0,0,0,FALSE
7,ammotragus_lervia,Aoudad,Ammotragus lervia,mm10,vs_HLammLer1,5205,Bovidae,,HLammLer1,Ammotragus_lervia_BOVIDAE_CETARTIODACTYLA,Ammotragus_lervia,HLammLer1,-,Herbivore,Herbivore,Herbivore,0,0,0,0,0,0,0,0,0,100,Ref_1,ABC,G,A,,0,1,1,Ref_3,D2,48000,Ref_117,1,1,0,0,0,0,1,0,0,0,0,0,0,0,0,Herbivore,0,0,0,0,0,0,0,1,NA,NA,NA,NA,NA,NA,NA,NA,NA,NA,NA,NA,NA,NA,NA,NA,NA,NA,NA,NA,0,Species,"Diet consists of grass, herbaceous plants, and stunted bushes.",,,,,NA,NA,NA,NA,0,0,0,1,0,0,1,TRUE
8,anoura_caudifer,Geoffroy's Long-nosed Bats,Anoura caudifer,NA,vs_HLanoCau1,4143,Phyllostomidae,,HLanoCau1,Anoura_caudifer_PHYLLOSTOMIDAE_CHIROPTERA,Anoura_caudifer,HLanoCau1,-,NA,Omnivore-IH,_Omnivore,30,0,0,0,0,0,30,40,0,0,Ref_1,ABC,Ar,A,,1,0,0,Ref_1,ABC,10.81,Ref_58,1,1,0,1,1,0,0,0,1,0,0,0,0,0,0,Insectivore/Herbivore,0,0,NA,NA,0,0,0,1,NA,NA,NA,NA,NA,NA,NA,NA,NA,NA,NA,NA,NA,NA,NA,NA,NA,NA,NA,NA,0,Genus,"The diet of this genus includes fruit, pollen, nectar, and insects",,,,,NA,wild,0,0,1,1,1,1,0,1,0,FALSE
9,antilocapra_americana,Pronghorn,Antilocapra americana,NA,vs_HLantAme1,5332,Antilocapridae,,HLantAme1,Antilocapra_americana_ANTILOCAPRIDAE_CETARTIODACTYLA,Antilocapra_americana,HLantAme1,-,NA,Herbivore,Herbivore,0,0,0,0,0,0,0,0,0,100,Ref_1,ABC,G,A,,1,1,1,Ref_1,ABC,46082.92,Ref_117,1,1,0,0,0,0,1,0,0,0,0,0,0,0,0,Herbivore,0,0,0,0,0,0,0,1,NA,NA,NA,NA,NA,NA,NA,NA,NA,NA,NA,NA,NA,NA,NA,NA,NA,NA,NA,NA,0,Species,"The pronghorn both grazes and browses on a wide variety of shrubs, forbs, grasses, cacti, and other plants. ",,,no,ARG,NA,captive,2,0,0,1,1,1,0,0,0,FALSE
10,aotus_nancymaae,Night Monkey,Aotus nancymaae,aotNan1,vs_aotNan1,642,Aotidae,aotNan1,aotNan1,Aotus_nancymaae_AOTIDAE_PRIMATES,Aotus_nancymaae,aotNan1,-,Omnivore,Omnivore,_Omnivore,20,0,0,0,10,0,20,10,20,20,Ref_1,ABC,Ar,A,,1,0,0,Ref_1,ABC,788.01,Ref_117,1,0,1,1,1,0,1,1,1,0,0,0,0,0,0,Omnivore,0,1,NA,NA,0,0,0,1,NA,NA,NA,NA,NA,NA,NA,NA,NA,NA,NA,NA,NA,NA,NA,NA,NA,NA,NA,NA,0,Genus,"The diet consists mainly of fruits, nuts, leaves, bark, flowers, gums, insects, and small vertebrates",,,,,NA,captive,2,0,0,0,1,0,0,0,1,TRUE
11,aplodontia_rufa,Sewellel ,Aplodontia rufa,NA,vs_HLaplRuf1,845,Aplodontiidae,,HLaplRuf1,Aplodontia_rufa_APLODONTIIDAE_RODENTIA,Aplodontia_rufa,HLaplRuf1,-,NA,Herbivore,Herbivore,0,0,0,0,0,0,0,0,0,100,Ref_1,ABC,G,A,,1,1,1,Ref_1,ABC,1003.99,Ref_117,1,0,0,0,0,0,1,0,0,0,0,0,0,0,0,Herbivore,0,0,0,0,0,0,0,1,NA,NA,NA,NA,NA,NA,NA,NA,NA,NA,NA,NA,NA,NA,NA,NA,NA,NA,NA,NA,0,Species,This rodent eats almost any plant material,,,,,NA,wild,0,0,0,0,1,1,0,0,0,FALSE
12,artibeus_jamaicensis,Neotropical Fruit Bats,Artibeus jamaicensis,NA,vs_HLartJam2,4076,Phyllostomidae,,HLartJam2,Artibeus_jamaicensis_PHYLLOSTOMIDAE_CHIROPTERA,Artibeus_jamaicensis,HLartJam2,-,NA,Herbivore,Herbivore,10,0,0,0,0,0,80,10,0,0,Ref_1,ABC,Ar,A,,1,0,0,Ref_1,ABC,42.17,Ref_117,1,1,0,1,0,0,1,0,0,0,0,0,0,0,0,Herbivore,0,0,0,0,0,0,0,1,NA,NA,NA,NA,NA,NA,NA,NA,NA,NA,NA,NA,NA,NA,NA,NA,NA,NA,NA,NA,0,Species,"Artibeus is primarily frugivorous but also consumes pollen, nectar, flower parts, and insects. Certain kinds of leaves may also be significant, at least in the diet of A. jamaicensis. Figs are the most important food of A. jamaicensis on Barro Colorado Island. a bat there may eat more than its weight in figs during a night. Other fruits known to be taken by Artibeus include mangoes, avocados, bananas, espave nuts, and the pulpy later surrounding the seeds of Acrocomia palms. ",,,,,NA,wild,0,0,1,1,1,1,0,0,0,FALSE
13,ateles_geoffroyi,Spider Monkeys,Ateles geoffroyi,NA,vs_HLateGeo1,614,Atelidae,,HLateGeo1,Ateles_geoffroyi_ATELIDAE_PRIMATES,Ateles_geoffroyi,HLateGeo1,-,NA,Omnivore,_Omnivore,10,0,0,0,10,0,60,0,10,10,Ref_1,ABC,Ar,A,,0,0,1,Ref_1,ABC,5284.94,Ref_117,1,0,0,1,1,0,1,1,0,1,0,0,0,0,0,Omnivore,0,0,NA,NA,0,0,0,1,NA,NA,NA,NA,NA,NA,NA,NA,NA,NA,NA,NA,NA,NA,NA,NA,NA,NA,NA,NA,0,Genus,"The diet consists largely of fruits, supplemented by nuts, seeds, bud, flowers, leaves, insects, arachnids, and eggs",,,,,NA,wild,0,0,0,0,1,0,0,0,0,FALSE
14,balaenoptera_acutorostrata,Minke Whale,Balaenoptera acutorostrata,balAcu1,vs_balAcu1,5340,Balaenopteridae,balAcu1,balAcu1,Balaenoptera_acutorostrata_BALAENOPTERIDAE_CETARTIODACTYLA,Balaenoptera_acutorostrata,balAcu1,-,Carnivore/Planktivore,Carnivore/Planktivore,Carnivore,70,0,0,30,0,0,0,0,0,0,Ref_1,ABC,M,A,,0,0,1,Ref_1,ABC,1.00E+07,Ref_117,1,1,0,0,1,0,0,0,0,0,0,0,1,1,0,Carnivore/Planktivore,0,1,NA,NA,1,1,1,0,NA,NA,NA,NA,NA,NA,NA,NA,NA,NA,NA,NA,NA,NA,NA,NA,NA,NA,NA,NA,0,Species,"In the Antarctic the diet consists almost exclusively of plankton, but in the Northern Hemisphere B acutorostrata also eats squid, herring, cod, sardines and various other kinds of small fish.",,,,,NA,wild,0,0,0,1,1,0,1,1,1,TRUE
15,balaenoptera_bonaerensis,Antartic Minke Whale,Balaenoptera bonaerensis,NA,vs_HLbalBon1,5341,Balaenopteridae,,HLbalBon1,Balaenoptera_bonaerensis_BALAENOPTERIDAE_CETARTIODACTYLA,Balaenoptera_bonaerensis,HLbalBon1,-,Planktivore,Planktivore,Planktivore,100,0,0,0,0,0,0,0,0,0,Ref_64,ABC,M,A,,0,0,1,Ref_1,ABC,35089915.83,"Ref_2, Ref_3",0,1,0,0,1,0,0,0,0,0,0,0,1,0,0,Planktivore,0,N/A,NA,NA,1,1,1,0,NA,NA,NA,NA,NA,NA,NA,NA,NA,NA,NA,NA,NA,NA,NA,NA,NA,NA,NA,NA,1,Genus,Doesn't have entry in NOWAK. Info from Minke Whale. ,,,,,NA,wild,0,0,0,1,1,0,0,0,0,FALSE
16,beatragus_hunteri,Sassabie,Beatragus hunteri,NA,vs_HLbeaHun1,5198,Bovidae,,HLbeaHun1,Beatragus_hunteri_BOVIDAE_CETARTIODACTYLA,Beatragus_hunteri,HLbeaHun1,-,NA,Herbivore,Herbivore,0,0,0,0,0,0,0,0,0,100,Ref_1,ABC,G,A,,0,1,1,Ref_1,ABC,79132.17,Ref_58,1,1,0,0,0,0,1,0,0,0,0,0,0,0,0,Herbivore,0,0,0,0,0,0,0,1,NA,NA,NA,NA,NA,NA,NA,NA,NA,NA,NA,NA,NA,NA,NA,NA,NA,NA,NA,NA,0,Genus,Also known as Damaliscus beatragus hunteri; Their diet mainly consists of grass,,,,,NA,captive,2,0,0,1,1,1,0,0,0,FALSE
17,bison_bison,American Bison,Bison bison,bisBis1,vs_bisBis1,5172,Bovidae,bisBis1,bisBis1,Bison_bison_BOVIDAE_CETARTIODACTYLA,Bison_bison,bisBis1,-,Herbivore,Herbivore,Herbivore,0,0,0,0,0,0,0,0,0,100,Ref_1,ABC,G,A,,1,1,1,Ref_1,ABC,579255.28,Ref_117,1,1,0,0,0,0,1,0,0,0,0,0,0,0,0,Herbivore,0,0,0,0,0,0,0,1,NA,NA,NA,NA,NA,NA,NA,NA,NA,NA,NA,NA,82,2.8,7.2,1.2,11,1.9,NA,NA,0,Genus,B. bison feeds mostly on grass,"The coefficient of variation for each macronutrient was

3.4% for carbohydrates and 17% for both lipids and pro-
teins, demonstrating that carbohydrates varied the least

relative to their mean percentages.",Lee J. HECKER et al. Mammel Review 2020,YES,ARG,NA,wild,0,0,0,1,1,1,0,0,1,TRUE
18,bos_indicus,Zebu,Bos indicus,HLbosInd1,vs_HLbosInd2,NA,NA,bosMut1,HLbosInd2,Bos_indicus_BOVIDAE_CETARTIODACTYLA,Bos_indicus,HLbosInd2,-,Herbivore,Herbivore,Herbivore,NA,NA,NA,NA,NA,NA,NA,NA,NA,NA,NA,NA,NA,NA,NA,NA,NA,NA,NA,NA,NA,NA,NA,1,0,0,0,0,1,0,0,0,0,0,0,0,0,Herbivore,0,0,0,0,0,0,0,1,NA,NA,NA,NA,NA,NA,NA,NA,NA,NA,NA,NA,NA,NA,NA,NA,NA,NA,NA,NA,0,Species,Domesticated cattle from India. Sub species of Bos taurus. Info from Bos taurus.,,,,,NA,domestic,1,1,0,1,1,1,0,0,1,TRUE
19,bos_mutus,Yak,Bos mutus,bosMut1,vs_HLbosMut2,NA,NA,bosMut1,HLbosMut2,Bos_mutus_BOVIDAE_CETARTIODACTYLA,Bos_mutus,HLbosMut2,-,Herbivore,Herbivore,Herbivore,NA,NA,NA,NA,NA,NA,NA,NA,NA,NA,NA,NA,NA,NA,NA,NA,NA,NA,NA,NA,NA,NA,NA,1,0,0,0,0,1,0,0,0,0,1,0,0,0,Herbivore,0,0,0,0,0,0,0,1,NA,NA,NA,NA,NA,NA,NA,NA,NA,NA,NA,NA,NA,NA,NA,NA,NA,NA,NA,NA,0,Species,"Domesticated yak. Wild yak Bos grunniens is considered conspecific according to NOWAK. Information from Bos grunniens. According to Grzimek, the yak stays in high areas with permanent snow during the relatively warm months of August and September and spends the rest of the year at lower elevations, feeding on grass, herbs, and lichens. ",,,,,NA,domestic,1,1,0,1,1,1,0,0,1,TRUE
20,bos_taurus,Cow,Bos taurus,bosTau8,vs_bosTau9,5175,Bovidae,bosTau7,bosTau9,Bos_taurus_BOVIDAE_CETARTIODACTYLA,Bos_taurus,bosTau9,-,Herbivore,Herbivore,Herbivore,0,0,0,0,0,0,0,0,0,100,Ref_1,ABC,G,A,,0,0,1,Ref_1,ABC,9.00E+05,Ref_117,1,1,0,0,0,0,1,0,0,0,0,0,0,0,0,Herbivore,0,0,0,0,0,0,0,1,NA,NA,NA,NA,NA,NA,NA,NA,NA,NA,NA,NA,NA,NA,NA,NA,NA,NA,NA,NA,0,Species,Grass ,,,,,NA,domestic,1,1,0,1,1,1,0,0,1,TRUE
21,bubalus_bubalis,Asian Water Buffalo,Bubalus bubalis,bubBub1,vs_HLbubBub2,5179,Bovidae,bubBub1,HLbubBub2,NA,Bubalus_bubalis,HLbubBub2,-,Herbivore,Herbivore,Herbivore,0,0,0,0,0,0,0,0,0,100,Ref_1,ABC,G,A,,1,1,1,Ref_1,ABC,431250,Ref_117,1,1,0,1,0,0,1,0,0,0,0,0,0,0,0,Herbivore,0,0,0,0,0,0,0,1,NA,NA,NA,NA,NA,NA,NA,NA,NA,NA,NA,NA,40.41,1.82,NA,NA,10.52,0.93,NA,NA,0,Genus,"They have a wide-ranging diet including grasses, ferns, saplings, palm, ginger, and fallen fruit","However, the mean nutrient composition
of the 16 most frequently consumed forage plants (19.4% protein:
73.7% carbohydrate: 6.9% lipid) was not significantly different than
the estimated nutrient balance (20.5% protein: 72.8% carbohydrate:
6.7% lipid) of their weighted diet",Tej Kumar Shrestha et al. Ecology and Evolution Original Research Wiley 2019,YES,ARG,NA,domestic,1,1,0,1,1,1,0,0,1,TRUE
22,callicebus_donacophilus,Titi Monkey,Callicebus donacophilus,NA,vs_HLpleDon1,661,Pitheciidae,,NA,Callicebus_donacophilus_PITHECIIDAE_PRIMATES,Callicebus_donacophilus,HLpleDon1,-,NA,Omnivore,_Omnivore,20,0,0,0,0,0,50,0,0,30,Ref_1,ABC,Ar,A,,0,0,1,Ref_1,ABC,795.01,Ref_117,1,0,1,1,1,1,1,0,0,1,0,0,0,0,0,Omnivore,0,1,NA,NA,0,0,0,1,NA,NA,NA,NA,NA,NA,NA,NA,NA,NA,NA,NA,NA,NA,NA,NA,NA,NA,NA,NA,0,Genus,"The diet consists mostly of fruits but also includes leaves, other vegetation, insects, other small invertebrates, birds' eggs, and small vertebrates",,,,,NA,wild,0,0,0,0,1,0,0,0,0,FALSE
23,callithrix_jacchus,Marmoset,Callithrix jacchus,calJac3,vs_HLcalJac4,580,Cebidae,calJac3,HLcalJac4,Callithrix_jacchus_CALLITRICHIDAE_PRIMATES,Callithrix_jacchus,HLcalJac4,-,Omnivore,Omnivore,_Omnivore,20,0,0,0,10,0,30,40,0,0,Ref_1,ABC,Ar,A,,0,0,1,Ref_1,ABC,292,Ref_117,1,0,1,1,1,0,1,1,1,0,0,0,0,0,0,Omnivore,0,1,NA,NA,0,0,0,1,NA,NA,NA,NA,NA,NA,NA,NA,NA,NA,NA,NA,NA,NA,NA,NA,NA,NA,NA,NA,0,,"insects, spiders, small vertebrates, birds' eggs, furits, and tree exudates, tree bark, 70 percent of forraging time of C. jacchus involves collections of gums and sap",,,,,NA,captive,2,0,0,0,1,0,0,0,1,TRUE
24,camelus_bactrianus,Bactrian Camel,Camelus bactrianus,HLcamBac1,vs_HLcamBac1,5119,Camelidae,camBac1,HLcamBac1,Camelus_bactrianus_CAMELIDAE_CETARTIODACTYLA,Camelus_bactrianus,HLcamBac1,-,Omnivore,Omnivore,_Omnivore,0,0,0,0,0,0,0,0,0,100,Ref_1,ABC,G,A,,0,0,1,Ref_1,ABC,690000,Ref_117,1,1,1,0,0,0,1,0,0,0,0,0,0,1,0,Omnivore,0,1,NA,NA,0,0,0,1,NA,NA,NA,NA,NA,NA,NA,NA,NA,NA,NA,NA,NA,NA,NA,NA,NA,NA,NA,NA,1,Genus,"Conspecific with C. ferus. C. ferus used to denote wild, but wild and domesticated can interbreed. Species names seem to be used interchangeably. Info from C. ferus. ",,,,,NA,domestic,1,1,0,1,1,0,0,0,1,TRUE
25,camelus_dromedarius,One-hump Camel,Camelus dromedarius,HLcamDro1,vs_HLcamDro2,5120,Camelidae,camDro1,HLcamDro2,Camelus_dromedarius_CAMELIDAE_CETARTIODACTYLA,Camelus_dromedarius,HLcamDro2,-,Omnivore,Omnivore,_Omnivore,0,0,0,0,0,0,0,0,0,100,Ref_1,ABC,G,A,,0,0,1,Ref_1,ABC,601000,Ref_117,1,1,1,0,0,0,1,0,0,0,0,0,0,1,0,Omnivore,0,1,NA,NA,0,0,0,1,NA,NA,NA,NA,NA,NA,NA,NA,NA,NA,NA,NA,NA,NA,NA,NA,NA,NA,NA,NA,0,Genus,"eat practically any vegetation that grows in the desert or semiarid regions. If forced by hunger, they will eat fish, flesh, bones, and skin.",,,,,NA,domestic,1,1,0,1,1,0,0,0,1,TRUE
26,camelus_ferus,Ferus Camel,Camelus ferus,HLcamFer2,vs_HLcamFer3,NA,NA,camFer1,HLcamFer3,Camelus_ferus_CAMELIDAE_CETARTIODACTYLA,Camelus_ferus,HLcamFer3,-,Omnivore,Omnivore,_Omnivore,NA,NA,NA,NA,NA,NA,NA,NA,NA,NA,NA,NA,NA,NA,NA,NA,NA,NA,NA,NA,NA,NA,NA,1,1,0,0,0,1,0,0,0,0,0,0,1,0,Omnivore,0,1,NA,NA,0,0,0,1,NA,NA,NA,NA,NA,NA,NA,NA,NA,NA,NA,NA,NA,NA,NA,NA,NA,NA,NA,NA,0,Genus,"eat practically any vegetation that grows in the desert or semiarid regions. If forced by hunger, they will eat fish, flesh, bones, and skin.",,,,,NA,wild,0,0,0,1,1,0,0,0,1,TRUE
27,canis_lupus,Dog,Canis lupus familiaris,canFam3,vs_canFam4,4927,Canidae,canFam3,HLcanLupDin1,Canis_lupus_CANIDAE_CARNIVORA,Canis_lupus_familiaris,canFam4,-,Carnivore,Carnivore,Carnivore,0,100,0,0,0,0,0,0,0,0,Ref_1,ABC,G,A,,1,1,0,Ref_1,ABC,32183.33,Ref_117,1,1,1,0,0,0,0,0,0,0,0,0,0,0,0,Carnivore,1,1,1,NA,0,0,0,1,NA,NA,NA,NA,NA,NA,NA,NA,NA,NA,NA,NA,NA,NA,NA,NA,NA,NA,0.072,13,0,,"steal from humans, scavenge, hunt deer, rats, birds",,,,,NA,wild,0,0,0,1,1,0,1,1,1,TRUE
28,canis_lupus,Wolf,Canis lupus,NA,NA,NA,Canidae,,,Canis_lupus_CANIDAE_CARNIVORA,Canis_lupus,NA,-,Carnivore,Carnivore,Carnivore,0,100,0,0,0,0,0,0,0,0,Ref_1,ABC,G,A,,1,1,0,Ref_1,ABC,32183.33,Ref_117,1,1,1,0,0,0,0,0,0,0,0,0,0,0,0,Carnivore,1,1,1,NA,0,0,0,1,NA,NA,NA,NA,NA,NA,NA,NA,NA,NA,NA,NA,NA,NA,NA,NA,NA,NA,0.072,13,0,,WARNING: This sheet seems to sometimes confuse dogs and wolves. ,,,,,NA,wild,0,0,0,1,1,0,1,1,1,TRUE
29,capra_aegagrus,Wild goat,Capra aegagrus,NA,vs_HLcapAeg1,NA,NA,,HLcapAeg1,Capra_aegagrus_BOVIDAE_CETARTIODACTYLA,Capra_aegagrus,HLcapAeg1,-,NA,Herbivore,Herbivore,NA,NA,NA,NA,NA,NA,NA,NA,NA,NA,NA,NA,NA,NA,NA,NA,NA,NA,NA,NA,NA,NA,NA,1,0,0,0,0,1,0,0,0,0,0,0,0,0,Herbivore,0,0,0,0,0,0,0,1,NA,NA,NA,NA,NA,NA,NA,NA,NA,NA,NA,NA,NA,NA,NA,NA,NA,NA,NA,NA,0,Species,"Food is taken by both grazing and browsing, depending on the season and availablilty",,,no,ARG,NA,wild,0,0,0,1,1,1,0,0,0,FALSE
30,capra_hircus,Domestic goat,Capra hircus,HLcapHir2,vs_HLcapHir2,5207,Bovidae,capHir1,HLcapHir2,Capra_hircus_BOVIDAE_CETARTIODACTYLA,Capra_hircus,HLcapHir2,-,Herbivore,Herbivore,Herbivore,0,0,0,0,0,0,0,0,0,100,Ref_1,ABC,G,A,,0,1,1,Ref_1,ABC,54250,Ref_117,1,1,0,0,0,0,1,0,0,0,0,0,0,0,0,Herbivore,0,0,0,0,0,0,0,1,NA,NA,NA,NA,NA,NA,NA,NA,NA,NA,NA,NA,NA,NA,NA,NA,NA,NA,NA,NA,0,Genus,All types of natural vegetation,,,,,NA,domestic,1,1,0,1,1,1,0,0,1,TRUE
31,capromys_pilorides,Desmarest cuban hutia,Capromys pilorides,NA,NA,3098,Capromyidae,,NA,Capromys_pilorides_CAPROMYIDAE_RODENTIA,Capromys_pilorides,NA,-,NA,Omnivore,_Omnivore,0,0,0,0,0,0,30,0,0,70,Ref_3,D2,G,A,,1,0,0,Ref_3,D2,5650,Ref_117,1,0,1,1,0,0,1,0,0,0,0,0,0,0,0,Omnivore,0,1,NA,NA,0,0,0,1,NA,NA,NA,NA,NA,NA,NA,NA,NA,NA,NA,NA,NA,NA,NA,NA,NA,NA,NA,NA,0,Species,"The diet of Capromys includes leaves, bark, fruits, lizards, and other small animals. ",,,,,NA,wild,0,0,0,0,1,0,0,0,0,FALSE
32,carollia_perspicillata,Short-tailed Leaf-nosed Bats,Carollia perspicillata,NA,vs_HLcarPer3,4174,Phyllostomidae,,HLcarPer3,Carollia_perspicillata_PHYLLOSTOMIDAE_CHIROPTERA,Carollia_perspicillata,HLcarPer3,-,NA,Omnivore-IH,_Omnivore,0,0,0,0,0,0,100,0,0,0,Ref_1,ABC,Ar,A,,1,0,0,Ref_1,ABC,18,Ref_117,1,1,0,1,1,0,0,0,1,0,0,0,0,0,0,Insectivore/Herbivore,0,0,NA,NA,0,0,0,1,NA,NA,NA,NA,NA,NA,NA,NA,NA,NA,NA,NA,NA,NA,NA,NA,NA,NA,NA,NA,0,Species,"The diet seems to consist mainly of fruits, including guavas, bananas, wild figs, and plantains. Sazima (1976) observed C. perspicillata taking nectar from passionflowers. In this species, and porbably others as well, insects also seem to be an important food. ",,,,,NA,wild,0,0,1,1,1,1,0,1,0,FALSE
33,castor_canadensis,Beaver,Castor canadensis,HLcasCan1,vs_HLcasCan3,1192,Castoridae,casCan1,HLcasCan3,Castor_canadensis_CASTORIDAE_RODENTIA,Castor_canadensis,HLcasCan3,-,Herbivore,Herbivore,Herbivore,0,0,0,0,0,0,0,0,0,100,Ref_1,ABC,G,A,,1,1,0,Ref_1,ABC,21820,Ref_117,1,0,0,0,0,0,1,0,0,0,0,0,0,0,0,Herbivore,0,0,0,0,0.5,NA,NA,0,NA,NA,NA,NA,NA,NA,NA,NA,NA,NA,NA,NA,NA,NA,NA,NA,NA,NA,0.045,17,0,Genus,"The feed on the bark, cambium, twigs, leaves, and roots of deciduous trees and shrubs, such as willow, alder, birch, and aspen, and on various parts of aquatic plants. ",,,,,NA,wild,0,0,0,0,1,1,0,0,1,TRUE
34,catagonus_wagneri,Chacoan Peccary,Catagonus wagneri,NA,vs_HLcatWag1,5114,Tayassuidae,,HLcatWag1,Catagonus_wagneri_TAYASSUIDAE_CETARTIODACTYLA,Catagonus_wagneri,HLcatWag1,-,NA,Omnivore,_Omnivore,0,0,0,0,0,0,0,0,30,70,Ref_1,ABC,G,A,,0,0,1,Ref_1,ABC,35566.41,Ref_117,1,1,1,0,0,0,1,1,0,0,0,0,0,0,0,Omnivore,0,1,NA,NA,0,0,0,1,NA,NA,NA,NA,NA,NA,NA,NA,NA,NA,NA,NA,NA,NA,NA,NA,NA,NA,NA,NA,0,Species,"Legume seeds, roots, and cacti are thought to be important components of the diet. Taber cited reports that Catagonus also sometimes eats carrion, may even prey on small mammals, and may not need to drink water. ",,,,,NA,captive,2,0,0,1,1,0,0,0,0,FALSE
35,cavia_aperea,Brazilian guinea pig,Cavia aperea,NA,vs_cavApe1,3042,Caviidae,,cavApe1,Cavia_aperea_CAVIIDAE_RODENTIA,Cavia_aperea,cavApe1,-,NA,Herbivore,Herbivore,0,0,0,0,0,0,0,0,0,100,Ref_1,ABC,G,A,,0,1,0,Ref_1,ABC,549,Ref_117,1,0,0,0,0,0,1,0,0,0,0,0,0,0,0,Herbivore,0,0,0,0,0,0,0,1,NA,NA,NA,NA,NA,NA,NA,NA,NA,NA,NA,NA,NA,NA,NA,NA,NA,NA,NA,NA,0,Genus,Diet consists of many kinds of vegetation,,,,,NA,NA,NA,NA,0,0,1,1,0,0,0,FALSE
36,cavia_porcellus,Domestic guinea pig,Cavia porcellus,cavPor3,vs_cavPor3,3044,Caviidae,cavPor3,cavPor3,Cavia_porcellus_CAVIIDAE_RODENTIA,Cavia_porcellus,cavPor3,-,Herbivore,Herbivore,Herbivore,0,0,0,0,0,0,0,0,0,100,Ref_1,ABC,G,A,,0,1,0,Ref_1,ABC,728,Ref_117,1,0,0,0,0,0,1,0,0,0,0,0,0,0,0,Herbivore,0,0,0,0,0,0,0,1,NA,NA,NA,NA,NA,NA,NA,NA,NA,NA,NA,NA,NA,NA,NA,NA,NA,NA,0.004,0.9,0,Genus,Diet consists of many kinds of vegetation,,,,,NA,captive,2,0,0,0,1,1,0,0,1,TRUE
37,cavia_tschudii,Montane guinea pig,Cavia tschudii,NA,vs_HLcavTsc1,3045,Caviidae,,HLcavTsc1,Cavia_tschudii_CAVIIDAE_RODENTIA,Cavia_tschudii,HLcavTsc1,-,NA,Herbivore,Herbivore,0,0,0,0,0,0,0,0,0,100,Ref_1,ABC,G,A,,0,1,0,Ref_1,ABC,1000,Ref_117,1,0,0,0,0,0,1,0,0,0,0,0,0,0,0,Herbivore,0,0,0,0,0,0,0,1,NA,NA,NA,NA,NA,NA,NA,NA,NA,NA,NA,NA,NA,NA,NA,NA,NA,NA,NA,NA,0,Genus,Diet consists of many kinds of vegetation,,,,,NA,captive,2,0,0,0,1,1,0,0,0,FALSE
38,cebus_albifrons,Ring-tailed Monkey,Cebus albifrons,NA,vs_HLcebAlb1,606,Cebidae,,HLcebAlb1,Cebus_albifrons_CEBIDAE_PRIMATES,Cebus_albifrons,HLcebAlb1,-,NA,Omnivore/Generalist,_Omnivore,20,0,0,0,10,0,20,10,20,20,Ref_1,ABC,Ar,A,,0,0,1,Ref_1,ABC,2629,Ref_117,1,0,1,1,1,0,1,1,1,1,0,0,1,0,0,Omnivore/Generalist,0,1,NA,NA,0,0,0,1,NA,NA,NA,NA,NA,NA,NA,NA,NA,NA,NA,NA,NA,NA,NA,NA,NA,NA,NA,NA,1,Genus,"The diet of Cebus is more varied than that of any other New World monkey. Foods include fruits, nuts, berries, seeds, flowers, buds, shoots, bark, gums, insects, arachnids, eggs, small vertebrates, oysters, crabs",,,,,NA,captive,2,0,0,0,1,0,0,0,0,FALSE
39,cebus_capucinus,Ring-tailed Monkey,Cebus capucinus,cebCap1,vs_cebCap1,601,Cebidae,cebCap1,cebCap1,Cebus_capucinus_CEBIDAE_PRIMATES,Cebus_capucinus,cebCap1,-,Omnivore/Generalist,Omnivore/Generalist,_Omnivore,20,0,0,0,10,0,20,10,20,20,Ref_1,ABC,Ar,A,,0,0,1,Ref_1,ABC,2733.32,Ref_117,1,0,1,1,1,0,1,1,1,1,0,0,1,0,0,Omnivore/Generalist,0,1,NA,NA,0,0,0,1,NA,NA,NA,NA,NA,NA,NA,NA,NA,NA,NA,NA,NA,NA,NA,NA,NA,NA,NA,NA,1,Genus,"The diet of Cebus is more varied than that of any other New World monkey. Foods include fruits, nuts, berries, seeds, flowers, buds, shoots, bark, gums, insects, arachnids, eggs, small vertebrates, oysters, crabs",,,,,NA,wild,0,0,0,0,1,0,0,0,1,TRUE
40,ceratotherium_simum,White rhinoceros,Ceratotherium simum,cerSim1,vs_cerSim1,5090,Rhinocerotidae,cerSim1,cerSim1,Ceratotherium_simum_RHINOCEROTIDAE_PERISSODACTYLA,Ceratotherium_simum_cottoni,cerSim1,-,Herbivore,Herbivore,Herbivore,0,0,0,0,0,0,0,0,0,100,Ref_1,ABC,G,A,,1,1,1,Ref_1,ABC,2949986.31,Ref_117,1,1,0,0,0,0,1,0,0,0,0,0,0,0,0,Herbivore,0,0,0,0,0,0,0,1,NA,NA,NA,NA,NA,NA,NA,NA,NA,NA,NA,NA,NA,NA,NA,NA,NA,NA,NA,NA,0,Species,"Differs from other rhinos in that it is entirely a grazer. It feeds largely on short grasses, using only the broad, flexible lips for cropping the stems. ",,,,,NA,wild,0,0,0,1,1,1,0,0,1,TRUE
41,ceratotherium_simum,White rhinoceros (Chad),Ceratotherium simum cottoni,NA,vs_HLcerSimCot1,5090,Rhinocerotidae,cerSim1,cerSim1,Ceratotherium_simum_RHINOCEROTIDAE_PERISSODACTYLA,Ceratotherium_simum,HLcerSimCot1,-,NA,NA,NA,NA,NA,NA,NA,NA,NA,NA,NA,NA,NA,NA,NA,NA,NA,NA,NA,NA,NA,NA,NA,NA,NA,NA,NA,NA,NA,NA,NA,NA,NA,NA,NA,NA,NA,NA,NA,NA,NA,NA,NA,NA,NA,NA,NA,NA,NA,NA,NA,NA,NA,NA,NA,NA,NA,NA,NA,NA,NA,NA,NA,NA,NA,NA,NA,NA,NA,NA,NA,NA,NA,NA,NA,NA,NA,NA,NA,NA,NA,NA,1,0,0,0,0,FALSE
